stories_id,publish_date,title,url,language,ap_syndicated,themes,media_id,media_name,media_url
1429998545,10/27/2019 10:38,IBM’s global chief data officer explains why changing culture to support AI is harder in a traditional tech company — and one way it’s easier,https://www.businessinsider.com/ibm-data-chief-ai-culture-shift-hard-at-tech-firms,en,FALSE,"computers and the internet, labor, computer software",18710,Business Insider,http://www.businessinsider.com
1430567688,10/28/2019 6:59,Exclusive: How AI keeps a fleet of chauffeur-driven electric SUVs all charged up,https://www.digitaltrends.com/mobile/havn-fleetonomy-ai-electric-car-fleet-news/,en,FALSE,,18380,digitaltrends.com,http://www.digitaltrends.com
1430598334,10/28/2019 8:00,Nvidia’s new Shield TV Pro and Shield TV add Dolby Vision and AI 4K upscaling,https://www.theverge.com/2019/10/28/20935782/nvidia-shield-tv-pro-announced-features-pricing-dolby-vision,en,FALSE,"computers and the internet, computer software",107634,The Verge,http://theverge.com/
1430624283,10/28/2019 8:00,Nvidia's Newest Set-Top Box Uses AI to Turn Content 4K,https://gizmodo.com/nvidias-newest-set-top-box-uses-ai-to-turn-content-4k-1839400236,en,FALSE,computers and the internet,4469,Gizmodo,http://gizmodo.com
1430701469,10/28/2019 9:50,Nvidia's New AI Lets You Know if Your Pet Would Look Cuter As a Different Animal,https://gizmodo.com/nvidias-new-ai-lets-you-know-if-your-pet-would-look-cut-1839411498,en,FALSE,"computers and the internet, animals",4469,Gizmodo,http://gizmodo.com
1430778548,10/28/2019 10:44,NVIDIA's AI can put your pet's smile on a random animal,https://www.engadget.com/2019/10/28/nvidia-ai-pet-expression-transfer-ganimal/,en,FALSE,animals,41231,engadget,http://www.engadget.com/
1430843223,10/28/2019 13:14,All the ways McDonald's is using AI to learn what you'll order — sometimes even before you know what you'll want,https://www.businessinsider.com/how-mcdonalds-is-harnessing-ai-know-orders-ahead-of-time,en,FALSE,"tests and testing, computers and the internet, advertising and marketing, computer software",18710,Business Insider,http://www.businessinsider.com
1430945609,7/29/2019 17:27,Pharma companies tap AI to innovate drug discovery and clinical trials - Business Insider,https://www.businessinsider.com/pharma-companies-tap-ai-to-innovate-drug-discovery-and-trials-2019-7?r=prmtwtr,en,FALSE,"tests and testing, medicine and health, drugs (pharmaceuticals), diseases and conditions",18710,Business Insider,http://www.businessinsider.com
1431210828,10/29/2019 8:12,The use of AI and ML in protecting the IoT,http://www.techradar.com/news/the-use-of-ai-and-ml-in-protecting-the-iot,en,FALSE,"privacy, computers and the internet, computer software, computer and video games, computer security",22116,techradar.com,http://www.techradar.com
1431225377,10/29/2019 10:24,"Facial recognition is on the rise, but artificial intelligence is already being trained to recognize humans in new ways — including gait detection and heartbeat sensors",https://www.insider.com/ai-training-beyond-facial-recognition-gait-detection-heartbeat-sensors-2019-10,en,FALSE,"politics and government, computers and the internet, terrorism, crime and criminals, airlines and airplanes, security and warning systems",287512,thisisinsider.com,http://thisisinsider.com/
1431272312,10/29/2019 11:01,THE AI PIVOT: How the push to adopt the advanced tech is rippling through corporate America,https://www.insider.com/artificial-intelligence-how-the-tech-is-rippling-through-companies,en,FALSE,"computers and the internet, finances, labor",287512,thisisinsider.com,http://thisisinsider.com/
1431270280,10/29/2019 11:01,THE AI PIVOT: How the push to adopt the advanced tech is rippling through corporate America,https://www.businessinsider.com/artificial-intelligence-how-the-tech-is-rippling-through-companies,en,FALSE,"computers and the internet, finances, labor",18710,Business Insider,http://www.businessinsider.com
1431230345,10/29/2019 5:00,Learn AI and machine learning from a top online instructor for $29,http://feedproxy.google.com/~r/Mashable/~3/cTSb-ydsWXU/,en,FALSE,"computers and the internet, computer software",5527,Mashable!,http://mashable.com
1430907611,10/28/2019 14:24,Chatbots 101: How AI is Fueling the Disruptive Force in Customer Relations,http://feedproxy.google.com/~r/businessinsider/~3/TKPTxYDoBJ4/chatbots-101,en,FALSE,"computers and the internet, finances, computer software, telephones and telecommunications, cellular telephones",18710,Business Insider,http://www.businessinsider.com
1431802543,10/29/2019 19:53,Bellevue startup uses artificial intelligence to help English learners&#8217; pronunciation,https://www.seattletimes.com/business/technology/bellevue-startup-uses-artificial-intelligence-to-help-english-learners-pronunciation/?utm_source=RSS&utm_medium=Referral&utm_campaign=RSS_all,en,FALSE,"education and schools, computers and the internet, recordings (audio), language and languages",24940,Seattle Times,http://seattletimes.com
1432328393,10/30/2019 3:30,Letter: AI hiring system has limited value,https://www.dispatch.com/opinion/20191030/letter-ai-hiring-system-has-limited-value?rssfeed=true,en,FALSE,"politics and government, labor",41,The Columbus Dispatch,http://www.dispatch.com/
1432589892,10/30/2019 14:00,DeepMind’s StarCraft 2 AI is now better than 99.8 percent of all human players,https://www.theverge.com/2019/10/30/20939147/deepmind-google-alphastar-starcraft-2-research-grandmaster-level,en,FALSE,"computers and the internet, computer software, computer and video games, chess",107634,The Verge,http://theverge.com/
1432671748,10/30/2019 14:00,AI Bot Is the First to Play StarCraft II at the Grandmaster Level,https://gizmodo.com/ai-bot-is-the-first-to-play-starcraft-ii-at-the-grandma-1839471798,en,FALSE,"computers and the internet, computer and video games, games, chess",4469,Gizmodo,http://gizmodo.com
1432827152,10/30/2019 18:31,DeepMind's AI can now crush almost every human player in StarCraft 2     - CNET,https://www.cnet.com/news/deepminds-ai-can-now-crush-almost-every-human-player-in-starcraft-2/#ftag=CADf328eec,en,FALSE,"computer and video games, games, research, chess",4415,CNET,http://cnet.com
1432922311,10/30/2019 23:24,DeepMind AI now keeps up with 'StarCraft II' Grandmasters,https://www.engadget.com/2019/10/30/deepmind-ai-starcraft-ii-grandmaster-level/,en,FALSE,"computers and the internet, computer software",41231,engadget,http://www.engadget.com/
1433381932,10/31/2019 9:32,The Best Terminator (For Most Neural-Net Based Artificial Intelligences),https://slate.com/culture/2019/10/best-terminator-neural-net-based-artificial-intelligences-skynet-legion.html?via=rss,en,FALSE,no index terms from nytimes,19643,Slate.com,http://www.slate.com
1433474052,10/31/2019 10:48,The Ratings Game: Starbucks gets personal with Deep Brew artificial intelligence program,http://www.marketwatch.com/news/story.asp?guid=%7B9AF78ECA-FBF0-11E9-8FA4-88C931E031FB%7D&siteid=rss&rss=1,en,FALSE,"computers and the internet, finances, labor",1150,Wall Street Journal,https://www.wsj.com/
1433519312,10/31/2019 9:40,An artificial intelligence company backed by Microsoft is helping Israel surveil Palestinians,https://www.vox.com/2019/10/31/20937638/israel-surveillance-network-covers-palestinian-territories,en,FALSE,"computers and the internet, computer software",104828,Vox,http://www.vox.com
1433730731,10/31/2019 17:12,Artificial intelligence can now identify a bird just by looking at a photo,https://www.digitaltrends.com/news/artificial-intelligence-can-identify-a-bird-just-by-looking-at-a-photo/,en,FALSE,"computers and the internet, animals, birds, research",18380,digitaltrends.com,http://www.digitaltrends.com
1433991013,11/1/2019 2:18,Dubai displays tech reputation with global robotics contest,https://www.sacbee.com/news/business/article236895878.html#storylink=rss,en,FALSE,contests and prizes,26,The Sacramento Bee,http://www.sacbee.com/
1434035138,11/1/2019 2:18,Dubai displays tech reputation with global robotics contest,https://www.seattletimes.com/business/dubai-displays-tech-reputation-with-global-robotics-contest/?utm_source=RSS&utm_medium=Referral&utm_campaign=RSS_all,en,TRUE,,24940,Seattle Times,http://seattletimes.com
1434234086,11/1/2019 7:43,Dubai displays tech reputation with global robotics contest,https://www.chron.com/news/science/article/Dubai-displays-tech-reputation-with-global-14735371.php,en,TRUE,contests and prizes,10,houstonchronicle,http://www.chron.com/
1434531948,11/1/2019 13:52,America can't afford to sit out the artificial intelligence race,https://www.newsday.com/opinion/commentary/america-artificial-intelligence-race-ai-1.38109561,en,FALSE,"computers and the internet, finances",13,Newsday,http://www.newsday.com/
1434675822,11/1/2019 18:00,Pentagon advisory board releases principles for ethical use of artificial intelligence in warfare,https://www.washingtonpost.com/business/pentagon-advisory-board-releases-principles-for-ethical-use-of-artificial-intelligence-in-warfare/2019/11/01/d2943947-b0c1-46b3-ad2f-46129f3d9590_story.html,en,FALSE,"tests and testing, computers and the internet, armament, defense and military forces, terrorism, united states armament and defense, intelligence",2,Washington Post,http://washingtonpost.com
1435190857,11/2/2019 12:18,Pentagon's draft AI ethics guidelines fight bias and rogue machines,https://www.engadget.com/2019/11/02/pentagon-draft-ai-ethics-guidelines/,en,FALSE,"armament, defense and military forces",41231,engadget,http://www.engadget.com/
1435989074,11/4/2019 8:00,"If you’re worried artificial intelligence is coming for you, read Melanie Mitchell’s new book",https://www.chicagotribune.com/entertainment/books/ct-books-biblioracle-1110-20191104-yx36rnivkrfbdeohsd572bfyxi-story.html#ed=rss_www.chicagotribune.com/arcio/rss/category/entertainment/,en,FALSE,"books and literature, intelligence",9,Chicago Tribune,http://www.chicagotribune.com/
1436052910,11/4/2019 9:00,The head of AI for Microsoft’s cloud says that its new tools will ‘make this stuff really simple’ for even the biggest customers (MSFT),https://www.businessinsider.com/microsoft-azure-ai-new-tools-eric-boyd-2019-11,en,FALSE,"computers and the internet, computer software",18710,Business Insider,http://www.businessinsider.com
1436058959,11/4/2019 9:00,Adobe's advanced AI editing tools graduate to Creative Cloud apps,https://www.engadget.com/2019/11/04/adobe-creative-cloud-app-roundup/,en,FALSE,"computers and the internet, computer software",41231,engadget,http://www.engadget.com/
1436286867,11/4/2019 12:00,NVIDIA's RTX GPUs give a speed boost to Adobe's AI features ,https://www.engadget.com/2019/11/04/nvidia-rtx-adobe-app-speed-boost/,en,FALSE,"computers and the internet, computer software",41231,engadget,http://www.engadget.com/
1436498567,11/4/2019 18:15,Top Huawei exec Guo Ping says 5G will be 'the new electricity' when combined with AI and other technologies,https://www.insider.com/huawei-chairman-guo-ping-says-5g-will-be-new-electricity-2019-11,en,FALSE,"computers and the internet, computer software, telephones and telecommunications",287512,thisisinsider.com,http://thisisinsider.com/
1436501184,11/4/2019 18:15,Top Huawei exec Guo Ping says 5G will be 'the new electricity' when combined with AI and other technologies,http://feedproxy.google.com/~r/businessinsider/~3/5F-G0iY2Ggs/huawei-chairman-guo-ping-says-5g-will-be-new-electricity-2019-11,en,FALSE,"computers and the internet, computer software, telephones and telecommunications",18710,Business Insider,http://www.businessinsider.com
1436567794,11/4/2019 16:45,Who is afraid of Artificial Intelligence ? | Column,https://www.google.com/url?rct=j&sa=t&url=https://www.tampabay.com/opinion/2019/11/04/who-is-afraid-of-artificial-intelligence-column/&ct=ga&cd=CAIyGjUwNWU3NGI2NWFiYWI5NjY6Y29tOmVuOlVT&usg=AFQjCNFvK4Kvj0eLBO0Ik572IFhsUb7kUA,en,FALSE,"computers and the internet, intelligence",22,Tampa Bay Times,http://www.tampabay.com/
1436937818,11/5/2019 5:08,Do AI Skin Apps Actually Work? I Tested Out 5 & Here's What I Found,https://www.bustle.com/p/do-ai-skin-apps-actually-work-i-tested-out-5-heres-what-i-found-19253267,en,FALSE,"computers and the internet, medicine and health",98755,Bustle,http://www.bustle.com/#spider
1436996806,11/5/2019 7:38,This open source AI tool quickly isolates the vocals in any song,https://www.theverge.com/2019/11/5/20949338/vocal-isolation-ai-machine-learning-deezer-spleeter-automated-open-source-tensorflow,en,FALSE,"computers and the internet, recordings (audio), computer software, music",107634,The Verge,http://theverge.com/
1437163649,11/5/2019 11:00,NVIDIA's AI will help USPS handle packages 10 times faster,https://www.engadget.com/2019/11/05/usps-nvidia-ai-package-processing/,en,FALSE,"computers and the internet, computer software",41231,engadget,http://www.engadget.com/
1437249637,11/5/2019 12:09,"Adobe's CTO explains how it's competing with the rest of Silicon Valley for AI talent, and why it's trying to make its own products irrelevant before a competitor can (ADBE)",https://www.businessinsider.com/adobe-cto-artificial-intelligence-business-model-competition-2019-11,en,FALSE,"computers and the internet, computer software",18710,Business Insider,http://www.businessinsider.com
1437478751,11/5/2019 17:45,Henry Kissinger Warns That AI Will Fundamentally Alter Human Consciousness,https://gizmodo.com/henry-kissinger-warns-that-ai-will-fundamentally-alter-1839642809,en,FALSE,"politics and government, united states politics and government",4469,Gizmodo,http://gizmodo.com
1437681139,26:33.4,"Blavatnik owns AI Film, the independent film and production company that’s behind acclaimed film Lee Daniels’ The Butler and the summer 2015 release Mr. Holmes.",https://www.businessinsider.in/Meet-Len-Blavatnik-the-richest-man-in-Britain/Blavatnik-owns-AI-Film-the-independent-film-and-production-company-thats-behind-acclaimed-film-Lee-Daniels-The-Butler-and-the-summer-2015-release-Mr-Holmes-/slideshow/47790832.cms,en,FALSE,motion pictures,18710,Business Insider,http://www.businessinsider.com
1437716891,18:54.1,"In 1986, Blavatnik founded Access Industries, a privately held industrial company. Initially, AI was involved in Russian investments but has since diversified its portfolio.",https://www.businessinsider.in/Meet-Len-Blavatnik-the-richest-man-in-Britain/In-1986-Blavatnik-founded-Access-Industries-a-privately-held-industrial-company-Initially-AI-was-involved-in-Russian-investments-but-has-since-diversified-its-portfolio-/slideshow/47790821.cms,en,FALSE,finances,18710,Business Insider,http://www.businessinsider.com
1437969394,11/6/2019 6:00,California has 33 million acres of forest. This company is training artificial intelligence to scour it all for wildfire. ,https://www.washingtonpost.com/technology/2019/11/06/california-has-million-acres-forest-this-company-is-training-artificial-intelligence-scour-it-all-wildfire/,en,FALSE,"fires and firefighters, fires and firemen",2,Washington Post,http://washingtonpost.com
1438030369,11/6/2019 8:07,Microsoft president Brad Smith predicts AI will be as transformative to society as the combustion engine over the next 3 decades,https://www.businessinsider.com/brad-smith-ai-will-play-similar-role-to-combustion-engine-2019-11,en,FALSE,"computers and the internet, computer software",18710,Business Insider,http://www.businessinsider.com
1438066064,11/6/2019 8:07,Microsoft president Brad Smith predicts AI will be as transformative to society as the combustion engine over the next 3 decades,https://www.insider.com/brad-smith-ai-will-play-similar-role-to-combustion-engine-2019-11,en,FALSE,"computers and the internet, computer software",287512,thisisinsider.com,http://thisisinsider.com/
1438077977,4/15/2019 18:00,Salesforce co-CEO Keith Block on artificial intelligence and strategy - Business Insider,https://www.businessinsider.com/salesforce-co-ceo-keith-block-artificial-intelligence-strategy-2019-4?utm_source=feedburner&utm_medium=referral,en,FALSE,,18710,Business Insider,http://www.businessinsider.com
1438250275,11/6/2019 12:00,Israeli robotics delegation to Dubai marks warming Gulf ties,https://www.chicagotribune.com/business/blue-sky/sns-bc-ml--israel-emirates-20191106-story.html#ed=rss_www.chicagotribune.com/arcio/rss/category/business/,en,FALSE,"politics and government, united states politics and government, international relations, palestinians, travel and vacations",9,Chicago Tribune,http://www.chicagotribune.com/
1438277620,11/6/2019 12:43,"The head of Microsoft's crucial new cloud AI team says that it can win against Amazon by focusing on practical tech that actually helps customers (MSFT, AMZN)",https://www.businessinsider.com/inside-microsoft-azure-ai-cloud-computing-amazon-web-services-2019-11,en,FALSE,"computers and the internet, appointments and executive changes, computer software",18710,Business Insider,http://www.businessinsider.com
1438376694,11/6/2019 14:40,National Security Commission Warns Pentagon of Falling Hopelessly Behind in the AI Arms Race,https://gizmodo.com/national-security-commission-warns-pentagon-of-falling-1839646571,en,FALSE,"politics and government, united states politics and government, armament, defense and military forces, united states armament and defense, international relations",4469,Gizmodo,http://gizmodo.com
1438399422,11/6/2019 15:07,Adobe previews an AI feature that can tell when an image has been manipulated,https://www.theverge.com/2019/11/6/20951569/adobe-max-sneaks-project-face-manipulation-about-face-sensei,en,FALSE,"computers and the internet, computer software",107634,The Verge,http://theverge.com/
1439051069,11/7/2019 7:24,OpenAI has published the text-generating AI it said was too dangerous to share,https://www.theverge.com/2019/11/7/20953040/openai-text-generation-ai-gpt-2-full-model-release-1-5b-parameters,en,FALSE,"computers and the internet, books and literature, electronic mail",107634,The Verge,http://theverge.com/
1439210854,11/7/2019 10:43,OpenAI published the tool that writes disturbingly believable fake news,https://www.engadget.com/2019/11/07/openai-published-ai-gpt-fake-news/,en,FALSE,"computers and the internet, research",41231,engadget,http://www.engadget.com/
1439285564,11/7/2019 12:00,"Google upgrades its no-coding, in-browser AI trainer to make it more functional",https://www.theverge.com/2019/11/7/20953095/google-ai-trainer-no-coding-visual-only-teachable-machine,en,FALSE,"computers and the internet, computer software",107634,The Verge,http://theverge.com/
1439391538,11/7/2019 13:44,Google's AI education tool makes it easy to train models for your projects,https://www.engadget.com/2019/11/07/google-teachable-machine-2/,en,FALSE,"computers and the internet, recordings (audio)",41231,engadget,http://www.engadget.com/
1439411215,11/7/2019 14:52,This $200 AI toothbrush was the most fun I've ever had brushing my teeth,https://www.businessinsider.com/review-oral-b-genius-x-ai-toothbrush-2019-11,en,FALSE,"computers and the internet, medicine and health, computer software, inventions and patents",18710,Business Insider,http://www.businessinsider.com
1439414505,11/7/2019 14:48,Artificial intelligence powerful gatekeeper in hiring for some of most prominent U.S. employers,http://www.startribune.com/artificial-intelligence-powerful-gatekeeper-in-hiring-for-some-of-most-prominent-u-s-employers/564609152/,en,FALSE,"education and schools, privacy, computers and the internet, labor",19,Star Tribune ,http://www.startribune.com/
1439439049,11/7/2019 14:52,This $200 AI toothbrush was the most fun I've ever had brushing my teeth,https://www.insider.com/review-oral-b-genius-x-ai-toothbrush-2019-11,en,FALSE,"computers and the internet, medicine and health, computer software, inventions and patents",287512,thisisinsider.com,http://thisisinsider.com/
1439562557,11/7/2019 18:19,EU competition commissioner Margrethe Vestager says there's 'no limit' to how AI can benefit humans,https://www.businessinsider.com/margrethe-vestager-artificial-intelligence-european-union-2019-11,en,FALSE,computers and the internet,18710,Business Insider,http://www.businessinsider.com
1439576144,11/7/2019 18:19,EU competition commissioner Margrethe Vestager says there's 'no limit' to how AI can benefit humans,https://www.insider.com/margrethe-vestager-artificial-intelligence-european-union-2019-11,en,FALSE,computers and the internet,287512,thisisinsider.com,http://thisisinsider.com/
1439946914,11/8/2019 5:01,Alexa as your new bestie: Can an AI robot or voice assistant help you feel less lonely?,http://rssfeeds.usatoday.com/~/608966476/0/usatodaycommoney-topstories~Alexa-as-your-new-bestie-Can-an-AI-robot-or-voice-assistant-help-you-feel-less-lonely/,en,FALSE,"motion pictures, reviews",4,USA Today,http://www.usatoday.com
1440011529,11/8/2019 7:22,How AI can help reduce money laundering,http://www.techradar.com/news/how-ai-can-help-reduce-money-laundering,en,FALSE,"politics and government, law and legislation, finances, crime and criminals, banks and banking, frauds and swindling",22116,techradar.com,http://www.techradar.com
1440255793,11/8/2019 11:44,Farmers are using AI to spot pests and catch diseases — and many believe it’s the future of agriculture,https://www.businessinsider.com/farmers-artificial-intelligence-in-agriculture-catch-disease-pests,en,FALSE,"computers and the internet, medicine and health, diseases and conditions, food, agriculture",18710,Business Insider,http://www.businessinsider.com
1440284627,11/8/2019 11:44,Farmers are using AI to spot pests and catch diseases — and many believe it’s the future of agriculture,https://www.insider.com/farmers-artificial-intelligence-in-agriculture-catch-disease-pests,en,FALSE,"computers and the internet, medicine and health, diseases and conditions, food, agriculture",287512,thisisinsider.com,http://thisisinsider.com/
1440383679,11/8/2019 14:24,"Hot AI startup UiPath's job cuts were triggered after it burned cash faster than expected and missed its revenue target, according to an internal document",https://www.businessinsider.com/uipath-cash-burn-revenue-targets-project-dawn-job-cuts-2019-11,en,FALSE,"finances, labor, company reports, corporations, layoffs and job reductions",18710,Business Insider,http://www.businessinsider.com
1441555653,11/10/2019 9:30,Intuit's CEO explains why he thinks it's a myth that AI will be a job killer,https://www.businessinsider.com/intuit-ceo-thinks-a-myth-ai-will-be-a-job-killer-2019-11,en,FALSE,,18710,Business Insider,http://www.businessinsider.com
1441559120,11/10/2019 9:00,Seattle faith groups reckon with AI — and what it means to be &#8216;truly human&#8217;,https://www.seattletimes.com/business/technology/seattle-faith-groups-reckon-with-ai-and-what-it-means-to-be-truly-human/?utm_source=RSS&utm_medium=Referral&utm_campaign=RSS_all,en,FALSE,"religion and churches, medicine and health",24940,Seattle Times,http://seattletimes.com
1441747445,11/10/2019 15:00,California has 33 million acres of forest. This company is training artificial intelligence to scour it all for wildfire,https://www.denverpost.com/2019/11/10/california-wildfire-artificial-intelligence-chooch/,en,FALSE,"fires and firefighters, fires and firemen, forests and forestry",31,The Denver Post,http://www.denverpost.com/
1441804948,11/10/2019 19:00,Artificial Intelligence Is Too Important to Leave to Google and Facebook Alone,https://www.nytimes.com/2019/11/10/opinion/artificial-intelligence-facebook-google.html,en,FALSE,"computers and the internet, finances, medicine and health, computer software",1,New York Times,http://nytimes.com
1441855589,11/10/2019 20:38,Microsoft AI helps diagnose cervical cancer faster,https://www.engadget.com/2019/11/10/microsoft-ai-diagnoses-cervical-cancer-faster/,en,FALSE,"medicine and health, diseases and conditions, cancer",41231,engadget,http://www.engadget.com/
1442291087,11/11/2019 10:04,What if AI actually isn’t out for our jobs?,http://www.techradar.com/news/what-if-ai-actually-isnt-out-for-our-jobs,en,FALSE,"computers and the internet, labor, computer software",22116,techradar.com,http://www.techradar.com
1442355018,11/11/2019 11:14,Investors just poured more than $1 billion into startups using AI to tackle every part of healthcare. Here are the 5 healthcare AI startups raking in the most cash.,https://www.businessinsider.com/top-5-healthcare-ai-deals-of-2019-cb-insights-2019-11,en,FALSE,"computers and the internet, finances, medicine and health",18710,Business Insider,http://www.businessinsider.com
1442422384,11/11/2019 13:00,"An AI startup says it's built a 'crystal ball' for advertising, and it has Mondelez, Ford, and Comcast buying in",https://www.businessinsider.com/ai-startup-dumbstruck-claims-to-use-emotion-to-evaluate-ads-2019-11,en,FALSE,"computers and the internet, advertising and marketing, advertising, marketing and merchandising",18710,Business Insider,http://www.businessinsider.com
1442445297,11/11/2019 13:36,Will artificial intelligence make work better — or worse? Seattle Times event explores the future of work,https://www.seattletimes.com/business/technology/will-artificial-intelligence-make-work-better-or-worse-seattle-times-event-explores-the-future-of-work/?utm_source=RSS&utm_medium=Referral&utm_campaign=RSS_all,en,FALSE,"computers and the internet, labor",24940,Seattle Times,http://seattletimes.com
1443072798,11/12/2019 7:22,AI ready to disrupt the property market,http://www.techradar.com/news/ai-ready-to-disrupt-the-property-market,en,FALSE,"computers and the internet, labor, computer software, economic conditions and trends",22116,techradar.com,http://www.techradar.com
