stories_id,publish_date,title,url,language,ap_syndicated,themes,media_id,media_name,media_url
1342224382,7/18/2019 13:12,"Barsys $1,500 robot bartender promises cocktails with AI precision",https://www.engadget.com/2019/07/18/barsys-robotic-bartender-ai-cocktails/,en,FALSE,,41231,engadget,http://www.engadget.com/
1343168953,7/19/2019 13:30,The Great Failure of Facebook’s AI Content Moderation System,https://gizmodo.com/the-great-failure-of-facebook-s-ai-content-moderation-s-1836500403,en,FALSE,"computers and the internet, murders and attempted murders",4469,Gizmodo,http://gizmodo.com
1345188386,7/22/2019 9:00,"Microsoft is investing $1 billion in OpenAI, the Elon Musk-founded company that's trying to build human-like artificial intelligence (MSFT)",https://www.businessinsider.com/microsoft-openai-artificial-general-intelligence-investment-2019-7,en,FALSE,"computers and the internet, finances",18710,Business Insider,http://www.businessinsider.com
1345251449,7/22/2019 10:11,"
                                            True Wireless Earbuds, Funcl AI Bluetooth 5.0 TWS Headphones, Waterproof Earphones with 3D Stereo AptX Hi-Fi Sound, 24H Playtime, Touch Control, Charging Case and Noise-Cancelling Mic                                                            ",https://leadgen-cbslnk.cnet.com/redir?assetguid=0f8291bf-2b19-4370-928f-e409604b7833&contype=deal&destUrl=https%3A%2F%2Fwww.amazon.com%2FFuncl-AI-Headphones-Bluetooth-Earphones%2Fdp%2FB07LBSWV36%3Ftag%3Dcnet-gbdeals-20%26linkCode%3Ddf5&leadcpc=0.25&ltype=deal&merid=300346&pagetype=deals-feed&rsid=cbsicnetglobalsite&prodtitle=True%20Wireless%20Earbuds%2C%20Funcl%20AI%20Bluetooth%205.0%20TWS%20Headphones%2C%20Waterproof%20Earphones%20with%203D%20Stereo%20AptX%20Hi-Fi%20Sound%2C%2024H%20Playtime%2C%20Touch%20Control%2C%20Charging%20Case%20and%20Noise-Cancelling%20Mic&ttag=usdealsamazongblightningdealrss,en,FALSE,"computers and the internet, telephones and telecommunications, cellular telephones, retail stores and trade",4415,CNET,http://cnet.com
1345262090,7/22/2019 10:08,Microsoft invests $1 billion in OpenAI to pursue holy grail of artificial intelligence,https://www.theverge.com/2019/7/22/20703578/microsoft-openai-investment-partnership-1-billion-azure-artificial-general-intelligence-agi,en,FALSE,"computers and the internet, finances, computer software",107634,The Verge,http://theverge.com/
1345325584,7/22/2019 11:17,Microsoft invests $1 billion to OpenAI for new supercomputing tech     - CNET,https://www.cnet.com/news/microsoft-invests-1-billion-into-openai-as-part-of-multi-year-deal/#ftag=CADf328eec,en,FALSE,"computers and the internet, computer software",4415,CNET,http://cnet.com
1345363230,7/22/2019 12:18,This website uses AI to turn your selfies into haunted classical portraits,https://www.theverge.com/tldr/2019/7/22/20703810/ai-classical-portrait-apps-selfie-web-transformation,en,FALSE,"computers and the internet, art",107634,The Verge,http://theverge.com/
1345399234,7/22/2019 12:50,Microsoft invests $1 billion in OpenAI to pursue artificial intelligence that’s smarter than we are,https://www.washingtonpost.com/business/microsoft-invests-1-billion-in-openai-to-pursue-artificial-intelligence-thats-smarter-than-we-are/2019/07/22/e3a49596-c10e-4ac0-85a7-d41491c6d138_story.html,en,FALSE,"computers and the internet, computer software",2,Washington Post,http://washingtonpost.com
1345406566,7/22/2019 12:43,Microsoft to invest $1bn in OpenAI ,http://www.techradar.com/news/microsoft-to-invest-dollar1bn-in-openai,en,FALSE,"computers and the internet, finances, computer software",22116,techradar.com,http://www.techradar.com
1345440461,7/22/2019 14:04,Microsoft invests $1 billion in artificial intelligence lab co-founded by Elon Musk,http://rssfeeds.azcentral.com/~/604759588/0/phoenix/nation~Microsoft-invests-billion-in-artificial-intelligence-lab-cofounded-by-Elon-Musk/,en,FALSE,"computers and the internet, computer software",25128,AZCentral,http://www.azcentral.com
1345487486,7/22/2019 15:25,Microsoft wants to build artificial general intelligence: an AI better than humans at everything,https://www.vox.com/2019/7/22/20704184/microsoft-open-ai-billion-investment-artificial-intelligence,en,FALSE,"computers and the internet, computer software",104828,Vox,http://www.vox.com
1345488982,7/22/2019 14:43,Microsoft invests $1 billion in AI start-up,http://feeds.marketwatch.com/~r/marketwatch/marketpulse/~3/Fug-RbnEbu4/story.aspx,en,FALSE,"computers and the internet, finances, stocks and bonds",1150,Wall Street Journal,https://www.wsj.com/
1345500613,7/22/2019 14:43,Microsoft invests $1 billion in AI startup,http://feeds.marketwatch.com/~r/marketwatch/marketpulse/~3/Fug-RbnEbu4/story.aspx,en,FALSE,"computers and the internet, finances, stocks and bonds",35170,Marketwatch,https://www.marketwatch.com/
1345504070,7/22/2019 14:04,Microsoft invests $1 billion in artificial intelligence lab co-founded by Elon Musk,http://rssfeeds.usatoday.com/~/604759588/0/usatoday-newstopstories~Microsoft-invests-billion-in-artificial-intelligence-lab-cofounded-by-Elon-Musk/,en,FALSE,"computers and the internet, computer software",4,USA Today,http://www.usatoday.com
1345528572,7/22/2019 16:20,"Ai Weiwei on the global refugee crisis, the Chinese movie industry, and his new film",https://www.vox.com/culture/2019/7/22/20678786/ai-weiwei-interview-the-rest-human-flow-refugees-sheffield,en,FALSE,"motion pictures, documentary films and programs",104828,Vox,http://www.vox.com
1345629952,7/22/2019 18:13,"With $1 billion from Microsoft, an AI lab wants to mimic the brain",https://www.sfgate.com/business/article/With-1-billion-from-Microsoft-an-AI-lab-wants-14114786.php,en,FALSE,"computers and the internet, finances",14,sfchronicle,http://www.sfgate.com/
1345856100,7/23/2019 2:03,The AI Renaissance portrait generator isn't great at painting people of color,http://feedproxy.google.com/~r/Mashable/~3/AH-NYw6kTBk/,en,FALSE,"computers and the internet, art",5527,Mashable!,http://mashable.com
1345963645,7/23/2019 4:31,Could a computer predict auto crash injuries? Volvo and Hyundai are betting it can,http://rssfeeds.azcentral.com/~/604781382/0/phoenix/nation~Could-a-computer-predict-auto-crash-injuries-Volvo-and-Hyundai-are-betting-it-can/,en,FALSE,medicine and health,25128,AZCentral,http://www.azcentral.com
1345963616,7/23/2019 4:31,Could a computer predict auto crash injuries? Volvo and Hyundai are betting it can,http://rssfeeds.usatoday.com/~/604781382/0/usatoday-newstopstories~Could-a-computer-predict-auto-crash-injuries-Volvo-and-Hyundai-are-betting-it-can/,en,FALSE,medicine and health,4,USA Today,http://www.usatoday.com
1346215624,7/23/2019 10:20,This site uses AI to turn your selfies into classical portraits,https://nypost.com/2019/07/23/this-site-uses-ai-to-turn-your-selfies-into-classical-portraits/,en,FALSE,"computers and the internet, art",7,NY Post,http://www.nypost.com/
1346324427,7/23/2019 9:34,New Fox artificial intelligence TV drama to film in Chicago in the fall,http://feeds.chicagotribune.com/~r/chicagotribune/offtopic/~3/sKHQWPt8iQk/ct-next-fox-chicago-filming-20190723-pvrxdguxifa4fersk6pzc55uge-story.html,en,FALSE,"motion pictures, television",9,Chicago Tribune,http://www.chicagotribune.com/
1346642995,7/22/2019 0:01,Israeli startup uses artificial intelligence to predict auto crash injuries,http://rssfeeds.freep.com/~/604745596/0/freep/business~Israeli-startup-uses-artificial-intelligence-to-predict-auto-crash-injuries/,en,FALSE,medicine and health,20262,freep.com,http://www.freep.com
1346860187,7/24/2019 3:53,LG's 2019 ThinQ AI TV AirPlay 2 and Homekit support rolls out,http://www.techradar.com/news/lgs-2019-thinq-ai-tv-airplay-2-and-homekit-support-rolls-out,en,FALSE,"computers and the internet, recordings (audio)",22116,techradar.com,http://www.techradar.com
1347142093,7/24/2019 9:07,'We're light years ahead of where we were': Novartis CEO Vas Narasimhan told us how the Swiss drug giant is using AI for everything from evaluating managers to predicting its financials (NVS),https://www.businessinsider.com/novartis-vas-narasimhan-on-using-ai-data-in-business-operations-2019-7,en,FALSE,"tests and testing, finances, medicine and health, drugs (pharmaceuticals), corporations",18710,Business Insider,http://www.businessinsider.com
1347532187,7/24/2019 17:48,"
                                            Langogo AI Translator for Traveling                                                            ",https://leadgen-cbslnk.cnet.com/redir?assetguid=979b824d-c08c-4772-b689-f412c34fe8fe&contype=deal&destUrl=https%3A%2F%2Fwww.amazon.com%2FSurfit-Langogo-Translator-Languages-Noise-Cancelling%2Fdp%2FB07LF9XPJW%3Ftag%3Dcnet-gbdeals-20%26linkCode%3Ddf5&leadcpc=0.25&ltype=deal&merid=300346&pagetype=deals-feed&rsid=cbsicnetglobalsite&prodtitle=Langogo%20AI%20Translator%20for%20Traveling&ttag=usdealsamazongblightningdealrss,en,FALSE,"computers and the internet, travel and vacations",4415,CNET,http://cnet.com
1348240129,7/25/2019 8:00,This AI makes you look like a masterpiece — while teaching you about its own bias,https://www.vox.com/future-perfect/2019/7/25/20708589/ai-portraits-art-bias-classical-painting,en,FALSE,"computers and the internet, art",104828,Vox,http://www.vox.com
1348266795,7/25/2019 11:55,AI ‘emotion recognition’ can’t be trusted,https://www.theverge.com/2019/7/25/8929793/emotion-recognition-analysis-ai-machine-learning-facial-expression-review,en,FALSE,"computers and the internet, computer software",107634,The Verge,http://theverge.com/
1348274851,7/25/2019 11:45,Sponsored: 4 things you need to know about AI in the workplace,https://www.seattletimes.com/sponsored/4-things-you-need-to-know-about-ai-in-the-workplace/?utm_source=RSS&utm_medium=Referral&utm_campaign=RSS_all,en,FALSE,labor,24940,Seattle Times,http://seattletimes.com
1349073435,7/26/2019 9:00,&#8216;Crowdworking&#8217; provides the humans who train artificial intelligence,https://www.seattletimes.com/business/technology/crowdworking-provides-the-humans-who-train-artificial-intelligence-often-for-minimal-pay/?utm_source=RSS&utm_medium=Referral&utm_campaign=RSS_all,en,FALSE,"computers and the internet, recordings (audio), computer software",24940,Seattle Times,http://seattletimes.com
1349096330,7/26/2019 9:13,"I've been using the wildly popular AI astrology app that sends rude horoscopes every day. Somehow, being told that I'm constantly messing up has actually made me a better person.",https://www.businessinsider.com/ive-been-using-ai-astrology-app-made-my-life-better-2019-7,en,FALSE,computers and the internet,18710,Business Insider,http://www.businessinsider.com
1349120619,7/26/2019 9:48,SoftBank unveils $108 billion fund to invest in artificial intelligence,https://nypost.com/2019/07/26/softbank-unveils-108-billion-fund-to-invest-in-artificial-intelligence/,en,FALSE,"politics and government, finances, banks and banking, stocks and bonds, foreign investments",7,NY Post,http://www.nypost.com/
1349880408,7/27/2019 9:01,AI event brings together Japanese companies and U.S. innovators,https://www.seattletimes.com/business/technology/ai-event-brings-together-japanese-companies-and-us-innovators/?utm_source=RSS&utm_medium=Referral&utm_campaign=RSS_all,en,FALSE,,24940,Seattle Times,http://seattletimes.com
1349951961,7/27/2019 12:02,Capitol Watch: New York to take on artificial intelligence,https://www.sacbee.com/news/business/technology/article233210476.html#storylink=rss,en,FALSE,"education and schools, privacy, politics and government, law and legislation, computers and the internet, terrorism, crime and criminals",26,The Sacramento Bee,http://www.sacbee.com/
1349955060,7/27/2019 12:01,Capitol Watch: New York to take on artificial intelligence,https://www.sfgate.com/news/article/Capitol-Watch-New-York-to-take-on-artificial-14190092.php,en,TRUE,"privacy, politics and government, law and legislation, computers and the internet, terrorism, crime and criminals",14,sfchronicle,http://www.sfgate.com/
1351364625,7/29/2019 13:00,Facing your AI self at the 'Neural Mirror' art installation,https://www.engadget.com/2019/07/29/the-big-picture-ultravioletto-neural-mirror/,en,FALSE,"computers and the internet, recordings (audio), reviews",41231,engadget,http://www.engadget.com/
1351399118,7/29/2019 13:24,'Data is the epicenter of the AI revolution': How AI is disrupting the data center and enterprise IT markets,https://www.businessinsider.com/ai-is-changed-enterprise-business-large-small-use-data-technology-2019-7,en,FALSE,"computers and the internet, computer software",18710,Business Insider,http://www.businessinsider.com
1351399117,7/29/2019 13:25,AI is already in your home. Soon it could tell you how much sleep to get or help you communicate better with the world.,https://www.businessinsider.com/consumer-technology-ai-aims-to-help-connect-home-or-away-2019-7,en,FALSE,"computers and the internet, medicine and health",18710,Business Insider,http://www.businessinsider.com
1351399115,7/29/2019 13:25,Automated trading has already upended markets. Now AI could shake up stock picking and investment advice.,https://www.businessinsider.com/ai-investing-automated-trading-stock-picking-advice-2019-7,en,FALSE,"computers and the internet, finances, stocks and bonds",18710,Business Insider,http://www.businessinsider.com
1351399111,7/29/2019 13:26,Consumers are tuning out ads more than ever. Big brands are betting AI can help them break through with better targeting and personalization.,https://www.businessinsider.com/as-ad-blockers-proliferate-ai-helps-brands-reach-consumers-2019-7,en,FALSE,"computers and the internet, advertising and marketing, advertising, marketing and merchandising",18710,Business Insider,http://www.businessinsider.com
1351399108,7/29/2019 13:27,"The $1.2 trillion pharma industry has ambitions for AI technology, but 'people are ignoring' a lot of its uses",https://www.businessinsider.com/pharma-companies-tap-ai-to-innovate-drug-discovery-and-trials-2019-7,en,FALSE,"tests and testing, computers and the internet, medicine and health, drugs (pharmaceuticals), diseases and conditions, research",18710,Business Insider,http://www.businessinsider.com
1351421297,7/29/2019 14:02,How AI is changing everything,https://www.businessinsider.com/how-ai-is-changing-everything-2019-7,en,FALSE,computers and the internet,18710,Business Insider,http://www.businessinsider.com
1351442022,7/29/2019 14:37,AI IN TELECOMMUNICATIONS: Why carriers could lose out if they don't adopt AI fast — and where they can make the biggest gains,https://www.businessinsider.com/the-ai-in-telecommunications-report-2019-7,en,FALSE,"computers and the internet, finances, computer software, telephones and telecommunications",18710,Business Insider,http://www.businessinsider.com
1351473030,7/29/2019 14:58,AI is getting more in touch with your emotions     - CNET,https://www.cnet.com/news/ai-is-getting-more-in-touch-with-your-emotions/#ftag=CADf328eec,en,FALSE,"computers and the internet, crime and criminals, science and technology, research",4415,CNET,http://cnet.com
1352111060,7/30/2019 8:46,"A $4.5 billion biotech working on tech-driven cancer treatments told us how it's using AI in areas rivals are ignoring, and why companies that aren't could struggle",https://www.businessinsider.com/modernas-dave-johnson-on-using-machine-learning-for-overlooked-areas-2019-7,en,FALSE,"computers and the internet, finances, medicine and health, drugs (pharmaceuticals), diseases and conditions, cancer, research, genetics and heredity",18710,Business Insider,http://www.businessinsider.com
1352983627,7/31/2019 7:12,Nasdaq Deploys AI to Detect Stock-Market Abuse,https://www.wsj.com/articles/nasdaq-deploys-ai-to-detect-stock-market-abuse-11564571534?mod=rss_Technology,en,FALSE,"tests and testing, finances, stocks and bonds",1150,Wall Street Journal,https://www.wsj.com/
1353142008,7/31/2019 9:27,'Tech capitalism at its finest': JPMorgan picks AI over humans to write ads,https://www.stltoday.com/business/tech-capitalism-at-its-finest-jpmorgan-picks-ai-over-humans/article_3311e88d-c90b-50e8-be67-38a08d5ccf8c.html,en,FALSE,"computers and the internet, finances, advertising and marketing, computer software, advertising, banks and banking",27,St. Louis Post Dispatch,http://www.stltoday.com/
1353203844,7/31/2019 11:26,"Investors bet $7.3 billion on AI startups tackling healthcare, more than on any other industry",https://www.businessinsider.com/healthcare-is-top-industry-for-ai-startup-funding-cb-insights-2019-7,en,FALSE,"computers and the internet, finances, medicine and health",18710,Business Insider,http://www.businessinsider.com
1353262738,7/31/2019 13:00,DeepMind AI can predict kidney illness 48 hours before it occurs,https://www.engadget.com/2019/07/31/deepmind-ai-illness-prediction-veterans-affairs/,en,FALSE,medicine and health,41231,engadget,http://www.engadget.com/
1353312398,7/31/2019 13:22,"Google DeepMind's AI could give doctors a head start on saving lives, study says     - CNET",https://www.cnet.com/news/google-deepminds-ai-could-give-doctors-a-head-start-on-saving-lives-study-says/#ftag=CADf328eec,en,FALSE,"computers and the internet, medicine and health, diseases and conditions",4415,CNET,http://cnet.com
1353320289,7/31/2019 13:48,"AI and machine learning are changing our approach to medicine and the future of healthcare (GOOGL, IBM)",https://www.businessinsider.com/artificial-intelligence-healthcare,en,FALSE,"computers and the internet, finances, medicine and health",18710,Business Insider,http://www.businessinsider.com
1353342786,7/31/2019 1:27,‘Emotion detection’ AI is a $20 billion industry. New research says it can’t do what it claims.,https://www.washingtonpost.com/business/2019/07/31/emotion-detection-ai-is-billion-industry-new-research-says-it-cant-do-what-it-claims/,en,FALSE,"computers and the internet, computer software, research",2,Washington Post,http://washingtonpost.com
1353455906,7/31/2019 15:44,Entrepreneurs not threatened by AI and automation,http://www.techradar.com/news/entrepreneurs-not-threatened-by-ai-and-automation,en,FALSE,"computers and the internet, labor, computer software, small business",22116,techradar.com,http://www.techradar.com
1353485970,7/31/2019 16:43,AI now can spot fake news generated by AI     - CNET,https://www.cnet.com/news/ai-now-can-spot-fake-news-generated-by-ai/#ftag=CADf328eec,en,FALSE,"computers and the internet, research",4415,CNET,http://cnet.com
1353929515,8/1/2019 5:30,People With Autism Are Hot Hires for AI Jobs,https://www.wsj.com/articles/people-with-autism-are-hot-hires-for-ai-jobs-11564651804?mod=pls_whats_news_us_business_f,en,FALSE,"computers and the internet, medicine and health, labor, diseases and conditions",1150,Wall Street Journal,https://www.wsj.com/
1353985218,8/1/2019 7:00,JPMorgan doesn't want to get burned by AI and machine learning. Here's how it avoids costly mistakes.,https://www.businessinsider.com/jpmorgan-artificial-intelligence-machine-learning-2019-7,en,FALSE,"computers and the internet, finances, advertising and marketing, banks and banking",18710,Business Insider,http://www.businessinsider.com
1353988709,8/1/2019 7:51,How AI can support cybersecurity leaders,http://www.techradar.com/news/how-ai-can-support-cybersecurity-leaders,en,FALSE,"computers and the internet, finances, armament, defense and military forces, terrorism, crime and criminals, united states armament and defense",22116,techradar.com,http://www.techradar.com
1354019031,8/1/2019 7:48,'AI Bar' system makes sure patrons are served in the right order,https://www.engadget.com/2019/08/01/ai-bar-system-makes-sure-patrons-are-served-in-the-right-order/,en,FALSE,"computers and the internet, bars",41231,engadget,http://www.engadget.com/
1354111254,8/1/2019 9:35,The Technology 202: Did Andrew Yang succeed in stoking a debate on AI and universal basic income?,https://www.washingtonpost.com/news/powerpost/paloma/the-technology-202/2019/08/01/the-technology-202-did-andrew-yang-succeed-in-stoking-a-debate-on-ai-and-universal-basic-income/5d41c5f8602ff17879a187bd/,en,FALSE,"politics and government, united states politics and government, elections, labor",2,Washington Post,http://washingtonpost.com
1354140847,8/1/2019 10:41,"For the first time, an AI bot can defeat top players in Texas Hold&#8217;em &#8212;&#160;Future Blink",http://feedproxy.google.com/~r/Mashable/~3/LURRFks33Gs/,en,FALSE,computers and the internet,5527,Mashable!,http://mashable.com
1354300370,8/1/2019 13:41,Cedars-Sinai division director and UCLA instructor faces felony child porn charges,http://feeds.latimes.com/~r/latimes/features/religion/~3/E3ZQlrpmQdQ/cedars-sinai-hospital-director-guido-germano-charged-child-porn,en,FALSE,"computers and the internet, crime and criminals, sex crimes, children and youth, pornography and obscenity",6,LA Times,http://www.latimes.com/
1355091275,8/2/2019 9:55,Google's DeepMind is applying artificial intelligence to detect acute kidney disease (GOOGL),https://www.businessinsider.com/googles-deepmind-brings-artificial-intelligence-insights-to-kidney-disease-2019-8,en,FALSE,"computers and the internet, medicine and health, diseases and conditions, research",18710,Business Insider,http://www.businessinsider.com
1355091250,8/2/2019 10:01,Meet the tech CEO whose company is striving to bring AI to the little guy in retail,https://www.businessinsider.com/ai-solutions-retail-nextorbit-artificial-intelligence-2019-8,en,FALSE,"finances, retail stores and trade, small business",18710,Business Insider,http://www.businessinsider.com
1355173610,8/2/2019 12:00,AI and automation are making office life easier,https://www.engadget.com/2019/08/02/ai-automation-office-life-easier/,en,FALSE,computers and the internet,41231,engadget,http://www.engadget.com/
1355280520,8/2/2019 14:37,Google’s DeepMind says its AI can accurately detect acute kidney injury before doctors,https://nypost.com/2019/08/02/googles-deepmind-says-its-ai-can-accurately-detect-acute-kidney-injury-before-doctors/,en,FALSE,"tests and testing, medicine and health, diseases and conditions, research, blood, anatomy and physiology, heart",7,NY Post,http://www.nypost.com/
1355293248,8/2/2019 14:36,"AI IN MEDICAL DIAGNOSIS: How top US health systems are reacting to the disruptive force of AI by revolutionizing diagnostic imaging, clinical decision support, and personalized medicine",https://www.businessinsider.com/ai-in-medical-diagnosis-report-2019-8,en,FALSE,"medicine and health, hospitals",18710,Business Insider,http://www.businessinsider.com
1355312448,8/2/2019 15:00,"Dispensed: Insurers will now cover a $2.1 million drug for kids, the pharma industry's AI ambitions, and a caravan to Canada in search of cheaper insulin",https://www.businessinsider.com/dispensed-weekly-healthcare-newsletter-august-2-2019-8,en,FALSE,"finances, medicine and health, insurance, health insurance and managed care, drugs (pharmaceuticals), prices (fares, fees and rates)",18710,Business Insider,http://www.businessinsider.com
1355320157,8/2/2019 15:06,Peter Thiel says Google's AI work in China is 'bad for America'     - CNET,https://www.cnet.com/news/peter-thiel-says-googles-ai-work-in-china-is-bad-for-america/#ftag=CADf328eec,en,FALSE,"computers and the internet, armament, defense and military forces",4415,CNET,http://cnet.com
1355411163,8/2/2019 17:25,Should Artificial Intelligence Be Credited as an Inventor?,https://gizmodo.com/should-artificial-intelligence-be-credited-as-an-invent-1836920203,en,FALSE,"inventions and patents, research",4469,Gizmodo,http://gizmodo.com
1355446086,8/2/2019 18:47,Artist works to merge artificial intelligence and art,https://www.seattletimes.com/business/technology/artist-works-to-merge-artificial-intelligence-and-art/?utm_source=RSS&utm_medium=Referral&utm_campaign=RSS_all,en,FALSE,"computers and the internet, art",24940,Seattle Times,http://seattletimes.com
1355594238,8/2/2019 22:59,JPMorgan Chase picks AI over humans to write ads,https://www.sfgate.com/business/article/JPMorgan-Chase-picks-AI-over-humans-to-write-ads-14277695.php,en,FALSE,"computers and the internet, finances, advertising and marketing, banks and banking",14,sfchronicle,http://www.sfgate.com/
1355770910,8/3/2019 7:30,"Peter Thiel said that AI is a 'military technology' that will primarily be used 'by generals,' but experts say that view is 'way too pessimistic' (GOOG, GOOGL)",https://www.businessinsider.com/peter-thiel-claim-ai-primarily-military-technology-experts-disagree-2019-8,en,FALSE,computers and the internet,18710,Business Insider,http://www.businessinsider.com
1355826604,8/3/2019 9:26,"Everything you need to know about TensorFlow, a Google-created project that's helping companies like Uber, Twitter, and Airbnb put AI in their apps (GOOG, GOOGL, UBER, TWTR)",https://www.businessinsider.com/tensorflow-google-ai-project-uber-nasa-twitter-2019-8,en,FALSE,computers and the internet,18710,Business Insider,http://www.businessinsider.com
1355956935,8/3/2019 12:27,Elon Musk announced that he'll launch The Boring Company China in Shanghai at the end of August,https://www.businessinsider.com/elon-musk-boring-company-china-late-august-2019-8,en,FALSE,,18710,Business Insider,http://www.businessinsider.com
1356046768,8/3/2019 12:00,Beware of geeks bearing AI gifts,https://www.newsday.com/opinion/commentary/geeks-ai-gifts-dynamic-yield-1.34556317,en,FALSE,"computers and the internet, finances, advertising and marketing, news and news media, media, ethics, frauds and swindling",13,Newsday,http://www.newsday.com/
