stories_id,publish_date,title,url,language,ap_syndicated,themes,media_id,media_name,media_url
1170469009,1/19/2019 17:57,"
                                            LG 65"" 4K HDR ThinQ AI OLED UHD Smart TV for $1,992 + free shipping                         w/code EE300                                    ",https://leadgen-cbslnk.cnet.com/redir?assetguid=eb4c4d8e-8893-46ba-bcbf-4f33b5690bad&contype=deal&destUrl=https%3A%2F%2Fwww.dealnews.com%2Flw%2Fclick.html%3F20%2C2%2C17842714%2Ceref%3Dcnet-deals-rss&devicetype=desktop&ltype=Deal&merid=233&pagetype=deals-feed&rsid=cbsicnetglobalsite&siteid=1&ttag=usdealsdealnewsrss&assettitle=LG%2065%22%204K%20HDR%20ThinQ%20AI%20OLED%20UHD%20Smart%20TV%20for%20%241%2C992%20%2B%20free%20shipping&ctype=cpc&cval=0.09&leadCpc=0.09&mfgid=275152&pdguid=39aabdf6-c176-4c1f-8385-5ca7b1ff08db&promoHed=LG%2065%22%204K%20HDR%20ThinQ%20AI%20OLED%20UHD%20Smart%20TV%20for%20%241%2C992%20%2B%20free%20shipping&sc=us&sl=en&topicbrcrm=Home%20Entertainment%5ETVs&topicguid=1bf2fd92-c387-11e2-8208-0291187b029a,en,FALSE,"computers and the internet, prices (fares, fees and rates)",4415,CNET,http://cnet.com
1170839320,1/20/2019 11:00,Facebook backs an independent AI ethics research center,https://www.engadget.com/2019/01/20/facebook-tum-ai-ethics-research-center/,en,FALSE,"computers and the internet, advertising and marketing, ethics",41231,engadget,http://www.engadget.com/
1171257770,1/21/2019 5:00,Learn the secrets of AI on the cheap with this online course sale,http://feedproxy.google.com/~r/Mashable/~3/l_-HIkdByXk/,en,FALSE,computers and the internet,5527,Mashable!,http://mashable.com
1171567484,1/21/2019 12:22,Over a third of companies now use AI in some way ,http://www.techradar.com/news/over-a-third-of-companies-now-use-ai-in-some-way,en,FALSE,"computers and the internet, labor, research",22116,techradar.com,http://www.techradar.com
1172624778,1/21/2019 19:12,"AI policy is tricky. From around the world, they came to hash it out",https://www.sfgate.com/business/article/AI-policy-is-tricky-From-around-the-world-they-13550435.php,en,FALSE,"education and schools, computers and the internet",14,sfchronicle,http://www.sfgate.com/
1173162604,1/23/2019 10:00,Cadwell Turnbull on the implications of a collectively owned AI system,https://www.theverge.com/2019/1/23/18188083/cadwell-turnbull-interview-ai-climate-change-better-worlds,en,FALSE,"books and literature, hurricanes and tropical storms",107634,The Verge,http://theverge.com/
1173162600,1/23/2019 10:00,An AI combats hurricane season in “Monsters Come Howling in Their Season”,https://www.theverge.com/2019/1/23/18175285/cadwell-turnbull-sci-fi-story-common-ai-climate-change-better-worlds,en,FALSE,"hurricanes and tropical storms, travel and vacations",107634,The Verge,http://theverge.com/
1173188514,1/23/2019 9:28,"In Davos, U.S. executives warn that China is winning the AI race",https://www.washingtonpost.com/business/economy/in-davos-us-executives-warn-that-china-is-winning-the-ai-race/2019/01/23/4b18bed0-8f9f-49e3-8aaa-6f539a728521_story.html,en,FALSE,"politics and government, armament, defense and military forces, international relations, economic conditions and trends",2,Washington Post,http://washingtonpost.com
1173311632,1/23/2019 12:17,Can we make artificial intelligence ethical?,https://www.washingtonpost.com/opinions/can-we-make-artificial-intelligence-ethical/2019/01/23/b35d0c55-2f9a-4bb1-92b0-d6450a3deae9_story.html,en,FALSE,"politics and government, computers and the internet",2,Washington Post,http://washingtonpost.com
1173388353,1/23/2019 15:40,"Yes, artificial intelligence can be racist",https://www.vox.com/science-and-health/2019/1/23/18194717/alexandria-ocasio-cortez-ai-bias,en,FALSE,"computers and the internet, computer software",104828,Vox,http://www.vox.com
1173656095,1/24/2019 0:06,Chefs and truck drivers beware: AI is coming for your jobs,https://www.seattletimes.com/business/chefs-and-truck-drivers-beware-ai-is-coming-for-your-jobs/?utm_source=RSS&utm_medium=Referral&utm_campaign=RSS_all,en,FALSE,"labor, unemployment, economic conditions and trends, layoffs and job reductions",24940,Seattle Times,http://seattletimes.com
1173636469,1/24/2019 0:10,Chefs and truck drivers beware: AI is coming for your jobs,http://www.startribune.com/chefs-and-truck-drivers-beware-ai-is-coming-for-your-jobs/504789532/,en,FALSE,"labor, unemployment, economic conditions and trends, layoffs and job reductions",19,Star Tribune ,http://www.startribune.com/
1173886816,1/24/2019 8:17,Chefs and truck drivers beware: AI is coming for your jobs,https://www.newsday.com/business/us-jobs-disrupted-artificial-intelligence-1.26389827,en,FALSE,"labor, unemployment, economic conditions and trends, layoffs and job reductions",13,Newsday,http://www.newsday.com/
1173873994,1/24/2019 2:25,Chefs and truck drivers beware: AI is coming for your jobs,https://www.dispatch.com/ZZ/news/20190124/chefs-and-truck-drivers-beware-ai-is-coming-for-your-jobs?rssfeed=true,en,FALSE,"labor, unemployment, economic conditions and trends, layoffs and job reductions",41,The Columbus Dispatch,http://www.dispatch.com/
1173982109,1/24/2019 9:02,McLaren imagines a future with AI co-piloted race cars,https://www.engadget.com/2019/01/24/mclaren-formula-one-concept-2050/,en,FALSE,"accidents and safety, automobile racing",41231,engadget,http://www.engadget.com/
1174066485,1/24/2019 9:32,FIFA asks Thai premier to release Bahraini soccer player,http://rssfeeds.usatoday.com/~/593876756/0/usatodaycomsoccer-topstories~FIFA-asks-Thai-premier-to-release-Bahraini-soccer-player/,en,FALSE,"politics and government, soccer",4,USA Today,http://www.usatoday.com
1174229930,1/24/2019 15:21,DeepMind AI AlphaStar goes 10-1 against top 'StarCraft II' pros,https://www.engadget.com/2019/01/24/deepmind-ai-starcraft-ii-demonstration-tlo-mana/,en,FALSE,,41231,engadget,http://www.engadget.com/
1174164924,1/24/2019 15:00,Chefs and truck drivers beware: Artificial intelligence is coming for your jobs,https://www.staradvertiser.com/2019/01/24/breaking-news/chefs-and-truck-drivers-beware-artificial-intelligence-is-coming-for-your-jobs/,en,FALSE,"labor, food",39573,HonululuAdvertiser,http://www.staradvertiser.com/
1174205596,1/24/2019 14:50,"Spread of artificial intelligence to hit Midwest hardest, study finds",https://www.stltoday.com/news/national/govt-and-politics/spread-of-artificial-intelligence-to-hit-midwest-hardest-study-finds/article_5d086b61-c71c-5d89-9d41-501d0725354e.html,en,FALSE,"politics and government, united states politics and government, elections, labor, unemployment, economic conditions and trends, united states economy",27,St. Louis Post Dispatch,http://www.stltoday.com/
1174223115,1/24/2019 15:28,Artificial intelligence is coming for these types of jobs,https://nypost.com/2019/01/24/artificial-intelligence-is-coming-for-these-types-of-jobs/,en,FALSE,"labor, unemployment, economic conditions and trends, united states economy, food, layoffs and job reductions",7,NY Post,http://www.nypost.com/
1174257759,1/24/2019 17:16,DeepMind’s AI agents conquer human pros at Starcraft II,https://www.theverge.com/2019/1/24/18196135/google-deepmind-ai-starcraft-2-victory,en,FALSE,"computers and the internet, computer software, computer and video games, games, chess",107634,The Verge,http://theverge.com/
1174274285,1/24/2019 17:50,"StarCraft is a deep, complicated war strategy game. Google’s AlphaStar AI crushed it.",https://www.vox.com/future-perfect/2019/1/24/18196177/ai-artificial-intelligence-google-deepmind-starcraft-game,en,FALSE,"computers and the internet, labor, computer and video games, games",104828,Vox,http://www.vox.com
1174359590,1/24/2019 17:45,How quantum computing will help us build human-level AI video     - CNET,https://www.cnet.com/videos/how-quantum-computing-will-help-us-build-human-level-ai/#ftag=CADf328eec,en,FALSE,"computers and the internet, recordings (audio), computer software",4415,CNET,http://cnet.com
1174404135,1/24/2019 18:40,Cooks and truck drivers beware: AI is coming for your jobs,https://www.sfgate.com/business/article/Cooks-and-truck-drivers-beware-AI-is-coming-for-13559829.php,en,TRUE,labor,14,sfchronicle,http://www.sfgate.com/
1174553070,1/24/2019 21:00,Google's DeepMind AI Just Beat Two Pros At StarCraft II,https://kotaku.com/googles-deepmind-ai-just-beat-two-pros-at-starcraft-ii-1832034863,en,FALSE,games,4469,Gizmodo,http://gizmodo.com
1174717022,1/25/2019 5:17,A new app to track malnutrition in India using Microsoft's AI tech,http://www.techradar.com/news/a-new-app-to-track-malnutrition-in-india-using-microsofts-ai-tech,en,FALSE,"computers and the internet, medicine and health, children and youth",22116,techradar.com,http://www.techradar.com
1174959903,1/25/2019 10:29,An AI alarm clock company raised nearly $1 million on crowdfunding and went bankrupt,https://www.theverge.com/circuitbreaker/2019/1/25/18195771/bonjour-alarm-clock-kickstarter-indiegogo-shipping-bankrupt,en,FALSE,"computers and the internet, finances",107634,The Verge,http://theverge.com/
1175206185,1/25/2019 16:10,AI Finds Traces of a Lost Species in Human DNA,https://gizmodo.com/ai-finds-traces-of-a-lost-species-in-human-dna-1831875647,en,FALSE,"archaeology and anthropology, research, genetics and heredity, dna (deoxyribonucleic acid), biology and biochemistry",4469,Gizmodo,http://gizmodo.com
1175930863,1/26/2019 8:30,"Google’s AI defeats humans at StarCraft, Amazon readies fleet of delivery robots video     - CNET",https://www.cnet.com/videos/googles-ai-defeats-humans-at-starcraft-amazon-readies-fleet-of-delivery-robots/#ftag=CADf328eec,en,FALSE,computers and the internet,4415,CNET,http://cnet.com
1176198625,1/27/2019 3:55,Microsoft and MIT can detect AI 'blind spots' in self-driving cars,https://www.engadget.com/2019/01/27/microsoft-and-mit-ai-blind-spots/,en,FALSE,"computers and the internet, computer software, roads and traffic, automobiles, accidents and safety, data processing (computers)",41231,engadget,http://www.engadget.com/
1176236893,1/26/2019 12:15,Google's Effort to Prevent Blindness Shows AI Challenges,http://feeds.wsjonline.com/~r/wsj/xml/rss/3_7014/~3/klPsVKWjjp0/googles-effort-to-prevent-blindness-hits-roadblock-11548504004,en,FALSE,"tests and testing, medicine and health, diseases and conditions, research",1150,Wall Street Journal,https://www.wsj.com/
1176728551,1/27/2019 11:48,Finding the &#8216;blind spots&#8217; in autonomous vehicle artificial intelligence,https://www.digitaltrends.com/cars/blind-spots-autonomous-vehicles/,en,FALSE,"computers and the internet, medicine and health, automobiles, research",18380,digitaltrends.com,http://www.digitaltrends.com
1176839029,1/28/2019 1:18,Stephen A. Schwarzman: Can we make artificial intelligence ethical?,https://www.twincities.com/2019/01/28/stephen-a-schwarzman-can-we-make-artificial-intelligence-ethical/,en,FALSE,"politics and government, computers and the internet, finances, economic conditions and trends",52,St.Paul Pioneer-Press ,http://www.twincities.com/
1177006420,1/28/2019 5:00,Artificial intelligence could identify you and your health history from your step tracker,http://rssfeeds.azcentral.com/~/594403654/0/phoenix/nation~Artificial-intelligence-could-identify-you-and-your-health-history-from-your-step-tracker/,en,FALSE,"privacy, computers and the internet, medicine and health",25128,AZCentral,http://www.azcentral.com
1176975299,1/28/2019 5:00,Artificial intelligence could identify you and your health history from your step tracker,http://rssfeeds.usatoday.com/~/594403654/0/usatoday-newstopstories~Artificial-intelligence-could-identify-you-and-your-health-history-from-your-step-tracker/,en,FALSE,"privacy, computers and the internet, medicine and health",4,USA Today,http://www.usatoday.com
1177149842,1/28/2019 8:00,The state of AI in 2019,https://www.theverge.com/2019/1/28/18197520/ai-artificial-intelligence-machine-learning-computational-science,en,FALSE,"computers and the internet, advertising and marketing, medicine and health",107634,The Verge,http://theverge.com/
1177149840,1/28/2019 8:00,Unity developed a video game designed to test AI players,https://www.theverge.com/2019/1/28/18200188/unity-obstacle-tower-challenge-ai-game-test-research-benchmark,en,FALSE,"computers and the internet, computer software, computer and video games, games",107634,The Verge,http://theverge.com/
1177330712,1/28/2019 9:49,Meet the scientists who are training AI to diagnose mental illness,https://www.theverge.com/2019/1/28/18197253/ai-mental-illness-artificial-intelligence-science-neuroimaging-mri,en,FALSE,"computers and the internet, medicine and health, diseases and conditions, research",107634,The Verge,http://theverge.com/
1177760765,1/28/2019 22:28,Salvador Dali's AI clone will welcome visitors to his museum,https://www.engadget.com/2019/01/28/salvador-dali-ai-recreation/,en,FALSE,art,41231,engadget,http://www.engadget.com/
1178134649,1/29/2019 8:00,An AI reading list — from practical primers to sci-fi short stories,https://www.theverge.com/2019/1/29/18200585/understand-ai-artificial-intelligence-reading-list-books-scifi,en,FALSE,books and literature,107634,The Verge,http://theverge.com/
1178274055,1/29/2019 10:00,Can AI help crack the code of fusion power?,https://www.theverge.com/2019/1/29/18201220/nuclear-fusion-energy-artificial-intelligence-machine-learning-tae-google,en,FALSE,"computers and the internet, environment, energy and power, electric light and power, light",107634,The Verge,http://theverge.com/
1178612206,1/29/2019 17:01,IBM hopes 1 million diverse faces can reduce bias in AI     - CNET,https://www.cnet.com/news/ibm-hopes-1-million-diverse-faces-can-reduce-bias-in-ai/#ftag=CADf328eec,en,FALSE,"computers and the internet, medicine and health, computer software, women, research",4415,CNET,http://cnet.com
1179038805,1/30/2019 6:16,Forget the Final Fantasy 7 remake – this mod uses AI to update the 1997 original,http://www.techradar.com/news/forget-the-final-fantasy-7-remake-this-mod-uses-ai-to-update-the-1997-original,en,FALSE,"computer and video games, games",22116,techradar.com,http://www.techradar.com
1179156910,1/30/2019 9:00,Virtual creators aren’t AI — but AI is coming for them,https://www.theverge.com/2019/1/30/18200509/ai-virtual-creators-lil-miquela-instagram-artificial-intelligence,en,FALSE,computers and the internet,107634,The Verge,http://theverge.com/
1179188546,1/30/2019 9:25,Orlando-based AI startup acquired by California firm,http://feeds.orlandosentinel.com/~r/orlandosentinel/business/~3/N1TPqR5G_XQ/os-cfb-abe-ai-acquisition-technology-20190129-story.html,en,FALSE,"computers and the internet, finances, computer software, banks and banking, mergers, acquisitions and divestitures",38,The Orlando Sentinel,http://www.orlandosentinel.com/
1179255228,1/30/2019 11:00,The AI video game character that influenced an industry,https://www.theverge.com/2019/1/30/18201130/halo-cortana-ai-assistant-siri-alexa-video-game,en,FALSE,"computers and the internet, computer and video games, games",107634,The Verge,http://theverge.com/
1179342897,1/30/2019 11:51,Scientists train AI to turn brain signals into speech     - CNET,https://www.cnet.com/news/scientists-train-ai-to-turn-brain-signals-into-speech/#ftag=CADf328eec,en,FALSE,"computers and the internet, medicine and health, diseases and conditions, research, brain",4415,CNET,http://cnet.com
1179318754,1/30/2019 12:31,AI and ethics: looking inside the black box,http://www.techradar.com/news/ai-and-ethics-looking-inside-the-black-box,en,FALSE,"computers and the internet, medicine and health, computer software, ethics, research",22116,techradar.com,http://www.techradar.com
1179343995,1/28/2019 7:15,BP Ventures invests $5M into Houston startup's artificial intelligence technology,https://www.chron.com/business/energy/article/BP-Ventures-invests-5M-into-Houston-startup-s-13562582.php,en,FALSE,"computers and the internet, finances",10,houstonchronicle,http://www.chron.com/
1179326647,1/30/2019 13:00,How AI is solving one of music’s most expensive problems,https://www.theverge.com/2019/1/30/18201163/ai-mastering-engineers-algorithm-replace-human-music-production,en,FALSE,"computers and the internet, recordings (audio), reviews, music, recording equipment",107634,The Verge,http://theverge.com/
1179536903,1/30/2019 16:22,Argo AI can now test self-driving cars in California     - Roadshow,https://www.cnet.com/roadshow/news/argo-ai-self-driving-cars-permit-california/#ftag=CAD590a51e,en,FALSE,"tests and testing, automobiles",4415,CNET,http://cnet.com
1179828904,1/31/2019 3:03,"UN agency finds US, Asian companies seek most AI patents",https://www.washingtonpost.com/world/the_americas/un-agency-finds-us-asian-companies-seek-most-ai-patents/2019/01/31/add4ecf2-252e-11e9-b5b4-1d18dfb7b084_story.html,en,FALSE,"computers and the internet, computer software, inventions and patents",2,Washington Post,http://washingtonpost.com
1179816311,1/31/2019 3:05,"UN agency finds US, Asian companies seek most AI patents",http://www.startribune.com/un-agency-finds-us-asian-companies-seek-most-ai-patents/505125402/,en,FALSE,"computers and the internet, inventions and patents",19,Star Tribune ,http://www.startribune.com/
1179841553,1/31/2019 3:01,"UN agency finds US, Asian companies seek most AI patents",https://www.seattletimes.com/business/un-agency-finds-us-asian-companies-seek-most-ai-patents/?utm_source=RSS&utm_medium=Referral&utm_campaign=RSS_all,en,TRUE,"computers and the internet, computer software, inventions and patents",24940,Seattle Times,http://seattletimes.com
1179910164,1/31/2019 3:04,"UN agency finds US, Asian companies seek most AI patents",https://www.dispatch.com/ZZ/news/20190131/un-agency-finds-us-asian-companies-seek-most-ai-patents?rssfeed=true,en,TRUE,inventions and patents,41,The Columbus Dispatch,http://www.dispatch.com/
1179991751,1/31/2019 8:00,How AI is changing photography,https://www.theverge.com/2019/1/31/18203363/ai-artificial-intelligence-photography-google-photos-apple-huawei,en,FALSE,"computers and the internet, computer software, photography",107634,The Verge,http://theverge.com/
1180045837,1/31/2019 9:00,Google invented the AI version of a Hallmark card,https://www.theverge.com/2019/1/31/18201040/google-smart-replies-linguistic-doom-gmail,en,FALSE,"computers and the internet, books and literature",107634,The Verge,http://theverge.com/
1180139033,1/31/2019 11:40,What would make you trust an AI assistant? How about a face?,http://feedproxy.google.com/~r/Mashable/~3/FjsWULAVt7I/,en,FALSE,computers and the internet,5527,Mashable!,http://mashable.com
1180291268,1/31/2019 11:55,US and China take worldwide AI lead ,http://www.techradar.com/news/us-and-china-take-worldwide-ai-lead,en,FALSE,"computers and the internet, computer software, inventions and patents",22116,techradar.com,http://www.techradar.com
1180291265,1/31/2019 12:20,'AI could send us back to the stone age': In conversation with the End Of The World ,http://www.techradar.com/news/ai-could-send-us-back-to-the-stone-age-in-conversation-with-the-end-of-the-world,en,FALSE,"armament, defense and military forces",22116,techradar.com,http://www.techradar.com
1180398429,1/31/2019 17:12,"
                                            AI War: Fleet Command                                                            ",https://leadgen-cbslnk.cnet.com/redir?assetguid=7010cf3f-4370-46af-a8be-9f03b19d2de6&contype=deal&ctype=cpc&destUrl=https%3A%2F%2Fstore.steampowered.com%2Fapp%2F40400%2FAI_War_Fleet_Command%2F&deviceType=desktop&ltype=deal&merid=50000936&pagetype=deals-feed&rsid=cbsicnetglobalsite&topic=Video%20Games&topicguid=1c7ebf90-c387-11e2-8208-0291187b029a&skipdelay=1&ttag=rss,en,FALSE,"computer and video games, games",4415,CNET,http://cnet.com
1180799368,2/1/2019 4:30,AI is transformational for businesses of all sizes,http://www.techradar.com/news/ai-is-transformational-for-businesses-of-all-sizes,en,FALSE,"computers and the internet, finances",22116,techradar.com,http://www.techradar.com
1180942567,2/1/2019 9:00,"AI can make art now, but artists aren’t afraid",https://www.theverge.com/2019/2/1/18192858/adobe-sensei-celsys-clip-studio-colorize-ai-artificial-intelligence-art,en,FALSE,"computers and the internet, computer software, art",107634,The Verge,http://theverge.com/
1180984729,2/1/2019 8:00,"Drones, cameras and AI could be border wall alternatives     - CNET",https://www.cnet.com/news/drones-cameras-and-ai-could-be-border-wall-alternatives/#ftag=CADf328eec,en,FALSE,"politics and government, finances, budgets and budgeting, armament, defense and military forces, immigration and refugees, terrorism, security and warning systems",4415,CNET,http://cnet.com
1181029012,2/1/2019 10:00,Inside the larps that let human players experience AI life,https://www.theverge.com/2019/2/1/18185945/live-action-roleplaying-larp-game-design-artificial-intelligence-ethics-issues,en,FALSE,"computers and the internet, computer software",107634,The Verge,http://theverge.com/
1181481364,2/1/2019 23:00,Açai Express acelera su expansión dentro y fuera de Puerto Rico,https://www.elnuevodia.com/negocios/empresas/nota/açaiexpressacelerasuexpansiondentroyfueradepuertorico-2474389/,es,FALSE,,62552,El Nuevo Dia,http://elnuevodia.com/
1182749294,2/4/2019 7:00,"McCormick will use IBM artificial intelligence to develop flavors, products",http://feeds.baltimoresun.com/~r/baltimoresun/features/booksmags/rss2/~3/CL_2vmI49Ts/bs-bz-mccormick-artificial-intelligence-20190131-story.html,en,FALSE,"computers and the internet, food",34,The Baltimore Sun,http://www.baltimoresun.com/
1182928349,2/4/2019 10:16,Is AI a special ingredient to help make food taste better? IBM and McCormick think so,http://rssfeeds.usatoday.com/~/595533294/0/usatoday-techtopstories~Is-AI-a-special-ingredient-to-help-make-food-taste-better-IBM-and-McCormick-think-so/,en,FALSE,"food, cooking and cookbooks",4,USA Today,http://www.usatoday.com
1183139545,2/4/2019 17:40,"McCormick will use IBM artificial intelligence to develop flavors, products",https://www.stltoday.com/business/mccormick-will-use-ibm-artificial-intelligence-to-develop-flavors-products/article_0adc06b9-6229-5215-88ce-d1dd1f833a7f.html,en,FALSE,"computers and the internet, food",27,St. Louis Post Dispatch,http://www.stltoday.com/
1183137817,2/4/2019 18:45,Gig Workers Unknowingly Helped Google and the Pentagon Build AI for Drones: Report,https://gizmodo.com/gig-workers-unknowingly-helped-google-and-the-pentagon-1832340422,en,FALSE,"computers and the internet, labor, armament, defense and military forces, united states armament and defense",4469,Gizmodo,http://gizmodo.com
1183195600,2/4/2019 20:00,Google Doodle welcomes Chinese New Year with AI game     - CNET,https://www.cnet.com/news/google-doodle-welcomes-chinese-new-year-with-ai-game/#ftag=CADf328eec,en,FALSE,"new year, holidays and special occasions, festivals",4415,CNET,http://cnet.com
1183755191,2/5/2019 10:00,Playing Pictionary against computers could help AI learn common sense,https://www.theverge.com/2019/2/5/18211799/pictionary-computers-ai-allen-institute-for-artificial-intelligence-iconary-common-sense,en,FALSE,"computers and the internet, computer software, computer and video games",107634,The Verge,http://theverge.com/
1183748196,2/5/2019 10:29,How McCormick and IBM will use AI to create the next big spice,https://www.engadget.com/2019/02/05/mccormick-ibm-ai-next-big-spice/,en,FALSE,computers and the internet,41231,engadget,http://www.engadget.com/
1184022512,2/5/2019 14:48,Northwell to use artificial intelligence to identify at-risk patients,https://www.newsday.com/business/northwell-jvion-artificial-intelligence-1.26942757,en,FALSE,"computers and the internet, finances, medicine and health, computer software, hospitals",13,Newsday,http://www.newsday.com/
1184038366,2/5/2019 15:50,Your February Horoscope Is Here—We Built an AI Astrologer to Predict Your Future,https://gizmodo.com/your-february-horoscope-is-here-we-built-an-ai-astrolog-1832369049,en,FALSE,computers and the internet,4469,Gizmodo,http://gizmodo.com
1183980264,2/5/2019 9:00,Hypergiant deal boosts AI in Space City,https://www.chron.com/techburger/article/Hypergiant-deal-boosts-AI-in-Space-City-13588732.php,en,FALSE,"computers and the internet, space",10,houstonchronicle,http://www.chron.com/
1184141608,2/5/2019 22:45,Making New Drugs With a Dose of Artificial Intelligence,https://www.nytimes.com/2019/02/05/technology/artificial-intelligence-drug-research-deepmind.html,en,FALSE,"tests and testing, medicine and health, science and technology, research, genetics and heredity",1,New York Times,http://nytimes.com
1184439161,2/6/2019 4:30,How AI can prevent a Marriott situation from happening again,http://www.techradar.com/news/how-ai-can-prevent-a-marriott-situation-from-happening-again,en,FALSE,"privacy, politics and government, computers and the internet, finances, computer security",22116,techradar.com,http://www.techradar.com
1184442736,2/6/2019 4:02,Nuance's AI uses real interactions to make chat bots smarter,https://www.engadget.com/2019/02/06/nuances-ai-uses-real-interactions-to-make-chat-bots-smarter/,en,FALSE,"computers and the internet, computer software",41231,engadget,http://www.engadget.com/
1184901488,2/6/2019 13:08,Google blocked 100m spam Gmail messages using AI ,http://www.techradar.com/news/google-blocked-100m-spam-gmail-messages-using-ai,en,FALSE,"computers and the internet, computer software, electronic mail, computer security",22116,techradar.com,http://www.techradar.com
1185062454,2/6/2019 16:43,AI gets spicy with new McCormick flavors     - CNET,https://www.cnet.com/news/ai-gets-spicy-with-new-mccormick-flavors/#ftag=CADf328eec,en,FALSE,"computers and the internet, food",4415,CNET,http://cnet.com
