stories_id,publish_date,title,url,language,ap_syndicated,themes,media_id,media_name,media_url
1257754895,4/17/2019 13:00,Kia HabaNiro concept peppers New York with AI tech     - Roadshow,https://www.cnet.com/roadshow/news/kia-habaniro-concept-new-york-auto-show/#ftag=CADf328eec,en,FALSE,"automobiles, children and youth",4415,CNET,http://cnet.com
1258117367,4/17/2019 15:10,Google Adds AI That Automatically Stops You From Filling Your Pixel 3 With Selfie Trash,https://gizmodo.com/google-adds-ai-that-automatically-stops-you-from-fillin-1834113245,en,FALSE,"computers and the internet, computer software, telephones and telecommunications, cellular telephones, photography",4469,Gizmodo,http://gizmodo.com
1258234534,4/17/2019 15:12,These tech companies want to use AI to make you lunch at work,https://www.stltoday.com/business/these-tech-companies-want-to-use-ai-to-make-you/article_6c0fdb6c-78f4-51c6-a021-460ba7d98435.html,en,FALSE,"computers and the internet, labor, restaurants, food, retail stores and trade, small business",27,St. Louis Post Dispatch,http://www.stltoday.com/
1258616847,4/17/2019 18:16,Facebook confirms it’s working on an AI voice assistant for Portal and Oculus products ,https://www.theverge.com/2019/4/17/18412757/facebook-ai-voice-assistant-portal-oculus-vr-ar-products,en,FALSE,computers and the internet,107634,The Verge,http://theverge.com/
1259088002,4/17/2019 19:28,AI makes key protein research a million times faster     - CNET,https://www.cnet.com/news/ai-makes-key-protein-folding-research-a-million-times-faster/#ftag=CADf328eec,en,FALSE,"computers and the internet, medicine and health, computer software, science and technology, research, genetics and heredity, biology and biochemistry",4415,CNET,http://cnet.com
1259668314,4/18/2019 8:45,Artificial intelligence is helping old video games look like new,https://www.theverge.com/2019/4/18/18311287/ai-upscaling-algorithms-video-games-mods-modding-esrgan-gigapixel,en,FALSE,"computers and the internet, computer software, computer and video games, games",107634,The Verge,http://theverge.com/
1259683036,4/18/2019 9:30,Building reliable data pipelines with AI and DataOps,http://www.techradar.com/news/building-reliable-data-pipelines-with-ai-and-dataops,en,FALSE,computers and the internet,22116,techradar.com,http://www.techradar.com
1260011004,4/18/2019 20:32,The Battle Over Artificial Intelligence,https://www.nytimes.com/2019/04/18/opinion/letters/artificial-intelligence.html,en,FALSE,"privacy, politics and government, united states politics and government, armament, defense and military forces, terrorism, united states armament and defense, united states international relations, international relations, international trade and world market, embargoes and economic sanctions, freedom and human rights",1,New York Times,http://nytimes.com
1260188011,4/18/2019 21:37,Ai Weiwei remembers disappearance of 43 Mexican students,https://www.seattletimes.com/nation-world/nation/ai-weiwei-remembers-disappearance-of-43-mexican-students/?utm_source=RSS&utm_medium=Referral&utm_campaign=RSS_all,en,TRUE,"education and schools, art",24940,Seattle Times,http://seattletimes.com
1260186906,4/18/2019 21:45,Ai Weiwei remembers disappearance of 43 Mexican students,http://www.startribune.com/ai-weiwei-remembers-disappearance-of-43-mexican-students/508784132/,en,FALSE,"education and schools, art, speech, freedom of speech and expression",19,Star Tribune ,http://www.startribune.com/
1260188438,4/18/2019 21:55,Ai Weiwei remembers disappearance of 43 Mexican students,https://www.staradvertiser.com/2019/04/18/news/ai-weiwei-remembers-disappearance-of-43-mexican-students/,en,TRUE,"education and schools, art",39573,HonululuAdvertiser,http://www.staradvertiser.com/
1260192793,4/18/2019 21:40,Ai Weiwei remembers disappearance of 43 Mexican students,https://www.sacbee.com/entertainment/celebrities/article229448054.html#storylink=rss,en,FALSE,"education and schools, art, speech, freedom of speech and expression",26,The Sacramento Bee,http://www.sacbee.com/
1260193703,4/18/2019 21:39,Ai Weiwei remembers disappearance of 43 Mexican students,https://www.sfgate.com/news/world/article/Ai-Weiwei-remembers-disappearance-of-43-Mexican-13779529.php,en,TRUE,,14,sfchronicle,http://www.sfgate.com/
1260219695,4/18/2019 21:39,Ai Weiwei remembers disappearance of 43 Mexican students,https://www.stltoday.com/news/world/ai-weiwei-remembers-disappearance-of-mexican-students/article_93017a91-47ab-5678-95fc-1d7f2bc6c638.html,en,TRUE,"education and schools, art",27,St. Louis Post Dispatch,http://www.stltoday.com/
1260225022,4/18/2019 21:39,Ai Weiwei remembers disappearance of 43 Mexican students,https://www.newsday.com/news/region-state/ai-weiwei-remembers-disappearance-of-43-mexican-students-1.29970385,en,TRUE,"education and schools, art, speech",13,Newsday,http://www.newsday.com/
1260272444,4/17/2019 18:02,"Facebook is quietly building a voice-controlled AI assistant like Amazon Alexa (FB, GOOG, AMZN, AAPL)",http://feedproxy.google.com/~r/businessinsider/~3/_qwTN6srHgA/facebook-building-voice-controlled-ai-assistant-2019-4,en,FALSE,computers and the internet,18710,Business Insider,http://www.businessinsider.com
1260548923,4/19/2019 8:01,Facebook AI turns real people into controllable game characters,https://www.engadget.com/2019/04/19/facebook-ai-game-characters-from-video/,en,FALSE,"computers and the internet, recordings (audio), computer software, computer and video games, games",41231,engadget,http://www.engadget.com/
1260705283,4/19/2019 10:17,AI Might Soon Make it Easy to Put Yourself In Your Favorite Video Game,https://gizmodo.com/ai-might-soon-make-it-easy-to-put-yourself-in-your-favo-1834164822,en,FALSE,"computers and the internet, recordings (audio), computer and video games, games",4469,Gizmodo,http://gizmodo.com
1261101768,2/8/2019 0:00,The Current State of AI Adoption,https://blogs.wsj.com/cio/2019/02/08/the-current-state-of-ai-adoption/,en,FALSE,computers and the internet,1150,Wall Street Journal,https://www.wsj.com/
1261116082,47:29.9,AI - Business Insider,https://www.businessinsider.com/category/ai,en,FALSE,"computers and the internet, finances, electronic mail",18710,Business Insider,http://www.businessinsider.com
1261116257,2/18/2019 0:00,3 things we learned from Facebook's AI chief about the future of artificial intelligence,https://www.businessinsider.com/facebook-artificial-intelligence-yann-lecun-2019-2?r=US&IR=T,en,FALSE,"computers and the internet, computer software",18710,Business Insider,http://www.businessinsider.com
1261132085,1/23/2019 0:00,Salesforce CEO Marc Benioff calls artificial intelligence a 'new human right',https://www.businessinsider.com/salesforces-benioff-calls-artificial-intelligence-a-new-human-right-2019-1#comments,en,FALSE,"politics and government, medicine and health, labor, armament, defense and military forces, terrorism, economic conditions and trends",18710,Business Insider,http://www.businessinsider.com
1261176656,1/29/2019 0:00,"Novartis is betting that AI is the 'next great tool' for finding new, cutting-edge medicines. Here's how the $220 billion drug giant is using it.",https://www.businessinsider.com/jay-bradner-on-how-novartis-is-using-ai-for-drug-research-development-2019-1#comments,en,FALSE,"computers and the internet, advertising and marketing, medicine and health, drug abuse and traffic, drugs (pharmaceuticals), research",18710,Business Insider,http://www.businessinsider.com
1261190179,3/17/2019 17:00,Europe’s silver bullet in global AI battle: Ethics,https://www.politico.eu/pro/europe-silver-bullet-global-ai-battle-ethics/,en,FALSE,,18268,Politico,https://www.politico.com/
1261193035,2/1/2019 0:00,Employee confidence in Google CEO Sundar Pichai and his leadership team is reportedly at a six-year low,https://www.businessinsider.com/google-ceo-sundar-pichai-employee-confidence-2019-2?utm_source=feedburner&utm_medium=referral,en,FALSE,"computers and the internet, labor",18710,Business Insider,http://www.businessinsider.com
1261196983,4/9/2019 13:00,Facebook is using AI to map population density around the world,https://www.theverge.com/2019/4/9/18301738/facebook-artificial-intelligence-ai-map-world-population-density-humanitarian-efforts?utm_campaign=The%20Interface&utm_medium=email&utm_source=Revue%20newsletter,en,FALSE,computers and the internet,107634,The Verge,http://theverge.com/
1261213953,3/18/2019 6:10,POLITICO Pro Morning Tech: AI strategies — Terrorist content moderation — Dalton’s new proposals,https://www.politico.eu/pro/politico-pro-morning-tech-ai-strategies-terrorist-content-moderation-daltons-new-proposals/,en,FALSE,"politics and government, computers and the internet, united states politics and government, armament, defense and military forces, terrorism",18268,Politico,https://www.politico.com/
1261224031,2/21/2019 0:00,"IBM's Watson Anywhere lets customers run AI on any cloud they want, and it's a sign that IBM is pulling back from plugging its own cloud",https://www.businessinsider.com/ibms-watson-anywhere-strategy-customers-run-ai-on-any-cloud-they-want-2019-2#comments,en,FALSE,"computers and the internet, computer software",18710,Business Insider,http://www.businessinsider.com
1261229923,3/13/2019 8:33,Google will groom these 10 Indian startups that use AI and machine learning,https://www.businessinsider.in/google-will-groom-these-10-indian-startups-that-use-ai-and-machine-learning/articleshow/68384856.cms,en,FALSE,computers and the internet,18710,Business Insider,http://www.businessinsider.com
1261245446,2/15/2019 15:05,Musk-backed AI group: Our text generator is so good it's scary,https://www.cnet.com/news/musk-backed-ai-group-our-text-generator-is-so-good-its-scary/,en,FALSE,quotation of the day,4415,CNET,http://cnet.com
1261551884,4/19/2019 21:35,Akos clinics offer new way to get medical help using AI technology,http://rssfeeds.azcentral.com/~/601015886/0/phoenix/business~Akos-clinics-offer-new-way-to-get-medical-help-using-AI-technology/,en,FALSE,"medicine and health, health insurance and managed care",25128,AZCentral,http://www.azcentral.com
1262068925,4/21/2019 4:12,AI generates non-stop stream of death metal,https://www.engadget.com/2019/04/21/ai-generated-death-metal-stream/,en,FALSE,"reviews, music",41231,engadget,http://www.engadget.com/
1262373916,4/21/2019 13:37,"One month, 500,000 face scans: How China is using AI to profile a minority",https://www.sfgate.com/business/article/One-month-500-000-face-scans-How-China-is-using-13783271.php,en,FALSE,"religion and churches, islam, discrimination",14,sfchronicle,http://www.sfgate.com/
1244140123,4/8/2019 8:55,McCormick and IBM are using AI to invent new flavor combinations,http://rssfeeds.usatoday.com/~/595533294/0/usatoday-techtopstories~McCormick-and-IBM-are-using-AI-to-invent-new-flavor-combinations/,en,FALSE,"food, cooking and cookbooks",4,USA Today,http://www.usatoday.com
1244130157,3/29/2019 12:01,Artificial Intelligence: young officer Mike Kanaan helping Air Force lead the charge,http://rssfeeds.usatoday.com/~/600125506/0/usatoday-newstopstories~Artificial-Intelligence-young-officer-Mike-Kanaan-helping-Air-Force-lead-the-charge/,en,FALSE,"armament, defense and military forces, terrorism, united states armament and defense, airlines and airplanes",4,USA Today,http://www.usatoday.com
1262979909,4/22/2019 10:16,Safeway stores offering health care powered by artificial intelligence,http://rssfeeds.azcentral.com/~/601066272/0/phoenix/local~Safeway-stores-offering-health-care-powered-by-artificial-intelligence/,en,FALSE,"computers and the internet, medicine and health, health insurance and managed care, hospitals",25128,AZCentral,http://www.azcentral.com
1263575888,4/23/2019 5:10,Artificial Intelligence Tool Can Detect PTSD in a Voice,https://www.thedailybeast.com/artificial-intelligence-tool-can-detect-ptsd-in-a-voice?source=articles&via=rss,en,FALSE,"medicine and health, terrorism, diseases and conditions, research, mental health and disorders, brain",1707,The Daily Beast,http://www.thedailybeast.com/
1263894347,4/23/2019 8:00,They asked artificial intelligence to create a new game. One of its first ideas involved exploding Frisbees.,https://www.washingtonpost.com/technology/innovations/they-asked-artificial-intelligence-to-create-a-new-game-and-one-if-its-first-ideas-involved-an-exploding-frisbee/2019/04/23/2d158a1a-dfa7-403e-a2c0-d7ee463ce96c_story.html,en,FALSE,"soccer, athletics and sports",2,Washington Post,http://washingtonpost.com
1263969657,4/23/2019 3:20,Editorial: Working with China on AI is tricky business,https://www.dispatch.com/opinion/20190423/editorial-working-with-china-on-ai-is-tricky-business?rssfeed=true,en,FALSE,"politics and government, computers and the internet, finances, armament, defense and military forces, research",41,The Columbus Dispatch,http://www.dispatch.com/
1264965654,4/24/2019 12:00,Bumble’s ‘private detector’ AI will automatically detect and blur lewd images,https://www.theverge.com/2019/4/24/18514247/bumble-private-detector-ai-filter-lewd-images,en,FALSE,computers and the internet,107634,The Verge,http://theverge.com/
1264990103,4/24/2019 12:34,Tesla’s new AI chip isn’t a silver bullet for self-driving cars,https://www.theverge.com/2019/4/24/18514308/tesla-full-self-driving-computer-chip-autonomy-day-specs,en,FALSE,"computers and the internet, computer chips",107634,The Verge,http://theverge.com/
1265049470,4/24/2019 13:42,Bumble will use AI to protect you from unwanted dick pics     - CNET,https://www.cnet.com/news/bumble-will-use-ai-to-protect-you-from-unwanted-dick-pics/#ftag=CADf328eec,en,FALSE,computers and the internet,4415,CNET,http://cnet.com
1265054545,4/24/2019 13:47,Facebook's AI missed Christchurch shooting videos filmed in first-person,https://www.engadget.com/2019/04/24/facebook-christchurch-videos-ai/,en,FALSE,"law and legislation, computers and the internet, recordings (audio)",41231,engadget,http://www.engadget.com/
1265103711,4/24/2019 14:49, Bumble will use AI to detect unwanted nudes,https://www.engadget.com/2019/04/24/bumble-will-use-ai-to-detect-lewd-NSFW-images/,en,FALSE,"computers and the internet, women",41231,engadget,http://www.engadget.com/
1265437821,4/25/2019 0:08,"AP EXCLUSIVE: At Walmart, using AI to watch the store",https://www.sacbee.com/news/business/article229660044.html#storylink=rss,en,FALSE,computers and the internet,26,The Sacramento Bee,http://www.sacbee.com/
1265440337,4/25/2019 0:08,"AP EXCLUSIVE: At Walmart, using AI to watch the store",https://www.sfgate.com/business/technology/article/AP-EXCLUSIVE-At-Walmart-using-AI-to-watch-the-13793752.php,en,TRUE,food,14,sfchronicle,http://www.sfgate.com/
1265452051,4/25/2019 0:10,"AP EXCLUSIVE: At Walmart, using AI to watch the store",http://www.startribune.com/ap-exclusive-at-walmart-using-ai-to-watch-the-store/509042232/,en,FALSE,"retail stores and trade, supermarkets",19,Star Tribune ,http://www.startribune.com/
1265558390,4/25/2019 0:08,"AP EXCLUSIVE: At Walmart, using AI to watch the store",https://www.stltoday.com/news/national/ap-exclusive-at-walmart-using-ai-to-watch-the-store/article_d7bc2d1b-7917-594a-8ca7-0d3a52768340.html,en,TRUE,"retail stores and trade, supermarkets",27,St. Louis Post Dispatch,http://www.stltoday.com/
1265568369,4/25/2019 2:57,"AP EXCLUSIVE: At Walmart, using AI to watch the store",https://www.seattletimes.com/nation-world/nation/ap-exclusive-at-walmart-using-ai-to-watch-the-store/?utm_source=RSS&utm_medium=Referral&utm_campaign=RSS_all,en,TRUE,"retail stores and trade, supermarkets",24940,Seattle Times,http://seattletimes.com
1265908145,4/25/2019 10:18,Walmart experiments with AI to monitor stores in real time,https://www.newsday.com/business/walmart-levittown-intelligent-retail-lab-1.30227639,en,FALSE,"computers and the internet, food, retail stores and trade, supermarkets",13,Newsday,http://www.newsday.com/
1266062597,4/25/2019 13:00,"Cobra Kai season 2: Capable, not captivating; competent, not compelling",https://www.polygon.com/2019/4/25/18514920/cobra-kai-season-2-review-premiere-karate-kid,en,FALSE,reviews,69395,polygon.com,http://www.polygon.com/#spider
1266080589,4/25/2019 9:29,Walmart experiments with AI to monitor stores in real time,https://www.google.com/url?rct=j&sa=t&url=https://www.tampabay.com/business/walmart-experiments-with-ai-to-monitor-stores-in-real-time-20190425/&ct=ga&cd=CAIyGjUwNWU3NGI2NWFiYWI5NjY6Y29tOmVuOlVT&usg=AFQjCNG5jBukyb1Oe30aCipfU0qLhHIe_Q,en,FALSE,"computers and the internet, retail stores and trade, supermarkets",22,Tampa Bay Times,http://www.tampabay.com/
1266024875,4/25/2019 14:48,Q&A: Ian McEwan on how ‘Machines Like Me’ reveals the dark side of artificial intelligence,http://www.latimes.com/books/la-et-jc-ian-mcewan-interview-machines-like-me-20190425-story.html,en,FALSE,"no index terms from nytimes, books and literature, reviews, biographical information",6,LA Times,http://www.latimes.com/
1266183869,4/25/2019 16:20,Walmart experiments with AI to monitor stores in real time,https://nypost.com/2019/04/25/walmart-experiments-with-ai-to-monitor-stores-in-real-time/,en,FALSE,"computers and the internet, food, retail stores and trade, supermarkets",7,NY Post,http://www.nypost.com/
1266260970,4/25/2019 17:35,Walmart experiments with artificial intelligence to monitor stores,https://www.staradvertiser.com/2019/04/25/breaking-news/walmart-experiments-with-artificial-intelligence-to-monitor-stores/,en,TRUE,"computers and the internet, food, retail stores and trade, supermarkets",39573,HonululuAdvertiser,http://www.staradvertiser.com/
1266977362,4/26/2019 9:11,OpenAI’s MuseNet generates AI music at the push of a button,https://www.theverge.com/2019/4/26/18517803/openai-musenet-artificial-intelligence-ai-music-generation-lady-gaga-harry-potter-mozart,en,FALSE,"recordings (audio), music",107634,The Verge,http://theverge.com/
1267235622,4/26/2019 12:05,AI won&#8217;t see you if you hold this color printout. So steer clear of any and all self-driving vehicles,http://feeds.mashable.com/~r/Mashable/~3/MGWDT1vSb6c/,en,FALSE,"computers and the internet, recordings (audio), research, data processing (computers), new models, design and products",5527,Mashable!,http://mashable.com
1267521161,4/26/2019 22:07,Walmart experiments with AI to monitor stores in real time,https://www.sfgate.com/business/article/Walmart-experiments-with-AI-to-monitor-stores-in-13799779.php,en,FALSE,"computers and the internet, food, retail stores and trade, supermarkets",14,sfchronicle,http://www.sfgate.com/
1269070977,4/29/2019 6:09,Ai Everything,http://www.techradar.com/news/ai-everything,en,FALSE,economic conditions and trends,22116,techradar.com,http://www.techradar.com
1269126288,4/29/2019 6:59,Want to work for L'Oreal? Get ready to chat with an AI bot,https://www.stltoday.com/business/want-to-work-for-l-oreal-get-ready-to-chat/article_65a5a730-6114-5719-bf13-8cba57d98b38.html,en,FALSE,"computers and the internet, labor",27,St. Louis Post Dispatch,http://www.stltoday.com/
1269315820,4/29/2019 10:33,This futuristic grocery store uses AI to notify employees when items run out,http://feedproxy.google.com/~r/Mashable/~3/ctmMuCB1W7Q/,en,FALSE,"tests and testing, computers and the internet",5527,Mashable!,http://mashable.com
1269489436,4/29/2019 13:17,AI brought a 60-year old music-making machine to life,https://www.engadget.com/2019/04/29/electronium-raymond-scott-yuri-suzuki-music-ai/,en,FALSE,"recordings (audio), music",41231,engadget,http://www.engadget.com/
1269701513,4/29/2019 18:05,"IFA GPC 2019 highlights: Sennheiser’s superb soundbar, an AI razor and a new 8K TV",http://www.techradar.com/news/ifa-gpc-2019-highlights-sennheisers-superb-soundbar-an-ai-razor-and-a-new-8k-tv,en,FALSE,"television, trade shows and fairs",22116,techradar.com,http://www.techradar.com
1270150006,4/30/2019 7:42,Report revealed at Ai Everything Summit in Dubai shows Middle East on pace with global counterparts,http://www.techradar.com/news/report-revealed-at-ai-everything-summit-in-dubai-shows-middle-east-on-pace-with-global-counterparts,en,FALSE,"computers and the internet, international relations",22116,techradar.com,http://www.techradar.com
1270233499,4/30/2019 9:27,AI is the fuel to develop non-oil industries in UAE,http://www.techradar.com/news/ai-is-the-fuel-to-develop-non-oil-industries-in-uae,en,FALSE,economic conditions and trends,22116,techradar.com,http://www.techradar.com
1270461335,4/30/2019 13:02,"While a flashy AI event raged in Dubai, a once promising robotics startup shuttered",http://feedproxy.google.com/~r/Mashable/~3/OyMOLrUeDBA/,en,FALSE,"computers and the internet, computer software, trade shows and fairs",5527,Mashable!,http://mashable.com
1271071530,5/1/2019 6:51,"Skills gap holding back AI adoption, says Microsoft",http://www.techradar.com/news/skills-gap-holding-back-ai-adoption-says-microsoft,en,FALSE,"computers and the internet, computer software",22116,techradar.com,http://www.techradar.com
1271074815,5/1/2019 7:00,What if AI is just BS?,https://www.washingtonpost.com/outlook/what-if-ai-is-just-bs/2019/05/01/6c7d7307-66b6-4c3a-a42b-605492fa9a35_story.html,en,FALSE,"education and schools, labor",2,Washington Post,http://washingtonpost.com
1271365814,5/1/2019 13:30,Facebook wants AI researchers to figure out privacy     - CNET,https://www.cnet.com/news/facebook-wants-ai-researchers-learn-privacy-udacity-course/#ftag=CADf328eec,en,FALSE,"privacy, computers and the internet, computer software",4415,CNET,http://cnet.com
1271366124,5/1/2019 13:37,Companies who aren't investing in AI may risk falling behind ,http://www.techradar.com/news/companies-who-arent-investing-in-ai-may-risk-falling-behind,en,FALSE,,22116,techradar.com,http://www.techradar.com
1271393668,5/1/2019 14:19,Google's CallJoy is an AI phone operator for small businesses,https://www.engadget.com/2019/05/01/google-calljoy-ai-customer-service-small-business-duplex/,en,FALSE,"computers and the internet, computer software, electronic mail, telephones and telecommunications",41231,engadget,http://www.engadget.com/
1271444369,5/1/2019 15:20,Facebook shows how AI bans the only thing people actually want more of on Facebook: Weed,http://feedproxy.google.com/~r/Mashable/~3/GVU-sMShIDs/,en,FALSE,"computers and the internet, computer software, drug abuse and traffic",5527,Mashable!,http://mashable.com
1271453293,5/1/2019 15:21,IBM hopes AI can speed up glaucoma treatment,https://www.engadget.com/2019/05/01/ibm-ai-glaucoma/,en,FALSE,"computers and the internet, medicine and health, diseases and conditions",41231,engadget,http://www.engadget.com/
1271473731,5/1/2019 15:44,Facebook has a three-part plan for making AI more 'inclusive',https://www.engadget.com/2019/05/01/facebook-ai-inclusive-portal-camera-augmented-reality/,en,FALSE,"computers and the internet, computer software",41231,engadget,http://www.engadget.com/
1271523878,5/1/2019 16:32,Facebook says its new AI tech spots hate speech faster     - CNET,https://www.cnet.com/news/facebook-says-its-new-ai-tech-spots-hate-speech-faster/#ftag=CADf328eec,en,FALSE,computers and the internet,4415,CNET,http://cnet.com
1271961545,5/2/2019 6:16,Can AI actually write poetry?,http://www.techradar.com/news/can-ai-actually-write-poetry,en,FALSE,"computers and the internet, books and literature, computer software",22116,techradar.com,http://www.techradar.com
1272278056,5/2/2019 11:44,Google’s latest AI art project turns your face into a ‘poem portrait’,https://www.theverge.com/2019/5/2/18526783/google-ai-art-project-poem-portrait-es-devlin-ross-goodwin,en,FALSE,"computers and the internet, books and literature, computer software, art, reviews",107634,The Verge,http://theverge.com/
1273005050,5/3/2019 6:30,Three ways CIOs can successfully scale AI ,http://www.techradar.com/news/three-ways-cios-can-successfully-scale-ai,en,FALSE,"computers and the internet, finances",22116,techradar.com,http://www.techradar.com
1273064951,5/3/2019 7:19,Toyota AI Ventures doubles down with a second $100 million for mobility startups,https://www.digitaltrends.com/cars/toyota-ai-ventures-second-100-million-for-mobility-startups/,en,FALSE,"computers and the internet, finances, automobiles",18380,digitaltrends.com,http://www.digitaltrends.com
1273357018,5/3/2019 14:17,Microsoft launches Azure cloud services for AI and blockchain ,http://www.techradar.com/news/microsoft-launches-azure-cloud-services-for-ai-and-blockchain,en,FALSE,"computers and the internet, computer software",22116,techradar.com,http://www.techradar.com
1274442748,5/5/2019 3:35,Huawei aims to accelerate AI usage to at least 50% by 2024,http://www.techradar.com/news/huawei-aims-to-accelerate-ai-usage-to-at-least-50-by-2024,en,FALSE,computers and the internet,22116,techradar.com,http://www.techradar.com
1275462072,5/6/2019 9:25,Google's AI Assistant aims to transcend the smart speaker,https://www.sfgate.com/business/article/Google-s-AI-Assistant-aims-to-transcend-the-smart-13821979.php,en,TRUE,computers and the internet,14,sfchronicle,http://www.sfgate.com/
1275465543,5/6/2019 9:30,Google's AI Assistant aims to transcend the smart speaker,http://www.startribune.com/google-s-ai-assistant-aims-to-transcend-the-smart-speaker/509528112/,en,FALSE,computers and the internet,19,Star Tribune ,http://www.startribune.com/
1275466075,5/6/2019 9:25,Google&#8217;s AI Assistant aims to transcend the smart speaker,https://www.seattletimes.com/business/googles-ai-assistant-aims-to-transcend-the-smart-speaker/?utm_source=RSS&utm_medium=Referral&utm_campaign=RSS_all,en,TRUE,computers and the internet,24940,Seattle Times,http://seattletimes.com
